description,sku,pack,size,gtin,name,retail_price,is_catch_weight,average_case_weight,image,manufacturer_sku,ordering_unit,is_broken_case,content_url,brand,level_1,level_2,level_3,manufacturer_name,distributor_name,unit_price,extra_data
"The latest entry into our Small Lot Coffee series takes us to the Kintamani region of Bali, where the rich, 
volcanic soils (courtesy of nearby Mt. Batur) and warm climate create an ideal environment for growing bold, 
flavorful coffee beans. Here, in the lush, humid highlands, farmers hand-pick coffee cherries and wet-process 
them using the traditional giling basah method, where hulls are removed before the beans are completely dried, 
resulting in a stronger body and relatively reduced acidity. It all makes for a deliciously unique (and uniquely 
delicious) cup of coffee that could only come from Kintamani. In other words, everything a Trader Joe's Small 
Lot Coffee should be.

With its medium dark roast and balanced profile of orange peel, dried fruit, and warm vanilla, Trader Joe's  
Kintamani Small Lot Coffee is perfect for serving with sweet, fruit-forward pastries and hearty breakfast 
foods. Each sip starts with a spicy, almost peppery note, which is intercepted by the coffee's balanced acidity, and 
eventually flows into a gentle, vanilla-tinged finish. It all makes for a smooth, yet bold, start to your morning, 
but be warned, if you want a chance to enjoy it, act soon. Like all Trader Joe's Small Lot Coffees, supplies are 
decidedly limited.

 *Please check QIL to confirm current pricing.

Indonesia Bali Kintamani 
Small Lot Coffee",70105,,12 Oz,,Kintamani Small Lot Coffee,9.99,,,https://www.traderjoes.com/content/dam/trjo/products/m304/70105.png,,,,https://www.traderjoes.com/home/products/pdp/kintamani-small-lot-coffee-070105,,,,,,,,"{""item_title"":""Kintamani Small Lot Coffee"",""category_hierarchy"":[{""id"":2,""name"":""Products"",""__typename"":""CategoryTree""},{""id"":182,""name"":""Beverages"",""__typename"":""CategoryTree""},{""id"":194,""name"":""Coffee & Tea"",""__typename"":""CategoryTree""}],""primary_image"":""/content/dam/trjo/products/m304/70105.png"",""primary_image_meta"":{""url"":""/content/dam/trjo/products/m304/70105.png"",""metadata"":""{\""src\"":\""/content/dam/trjo/products/m304/70105.png/jcr:content/renditions/cq5dam.web.1280.1280\"",\""srcSet\"":[{\""src\"":\""/content/dam/trjo/products/m304/70105.png/jcr:content/renditions/webp-640.webp\"",\""media\"":\""(max-width: 847px)\"",\""type\"":\""image/webp\""},{\""src\"":\""/content/dam/trjo/products/m304/70105.png/jcr:content/renditions/webp-1280.webp\"",\""media\"":\""(min-width: 848px)\"",\""type\"":\""image/webp\""},{\""src\"":\""/content/dam/trjo/products/m304/70105.png/jcr:content/renditions/cq5dam.web.640.640\"",\""media\"":\""(max-width: 847px)\"",\""type\"":\""image/png\""},{\""src\"":\""/content/dam/trjo/products/m304/70105.png/jcr:content/renditions/cq5dam.web.1280.1280\"",\""media\"":\""(min-width: 848px)\"",\""type\"":\""image/png\""}],\""alt\"":\""Indonesia Bali Kintamani Small Lot Coffee\"",\""srcOriginal\"":\""/content/dam/trjo/products/m304/70105.png\""}"",""__typename"":""ImageWithMeta""},""sales_size"":12,""sales_uom_description"":""Oz"",""price_range"":{""minimum_price"":{""final_price"":{""currency"":""USD"",""value"":9.99,""__typename"":""Money""},""__typename"":""ProductPrice""},""__typename"":""PriceRange""},""fun_tags"":[""Glass Half Full"",""Rise & Shine""],""item_characteristics"":null,""__typename"":""SimpleProduct"",""dietaryTags"":"""",""product_variants"":[]}"
"When it comes to brewing, what's the difference between hot and cold? Yes, temperature, of course, but 
also bite. Cold brewed coffee is never heated. As a result, the oils and acids that are released commonly with 
heat, don't pass through to the brew. No longer masked by the compounds that give coffee its famous bitter 
bite, the nuanced lush, fruity flavors of the beans becomes strikingly more perceptible and, some would 
argue, more enjoyable. With more than 50% less acid than a hot brewed cup, cold brew is truly smooth.

Cold brewing is hot.  While we're pro-DIY, the actual percolation and filtration can take somewhere 
between 12-24 hours. Don't know about you, but our cup of coffee can't always wait, so; we bottled it! 
Working with craft coffee roasters in Texas, we start with a half a pound, medium roast, 100% Arabica beans 
from the world's finest growing regions. The beans are ground coarsely and specially filtered to create 32 
ounces of delicious, naturally sweet, ready-to-pour Trader Joe's Cold Brewed Coffee Concentrate. That's 
equivalent to about 96 ounces of coffee beverages when reconstituted with water, milk, etc. If you like it 
strong and steamy, mix it with a bit of hot water for a smooth cup. Or pour it over some ice for a cold cold 
brew. If you want to keep the coffee as concentrated as possible, you can use it to make coffee ice cubes for 
your iced coffee. And since it's ideal for adding coffee flavor without the acid bitterness, it's even great for 
use in baking, marinating, making cocktails or served Affogato-style over ice cream. We're selling each 32 
ounce container of Cold Brew Coffee Concentrate for $7.99, which is equal to about 66¢ a cup!

Serving Suggestion",50759,,32 Fl Oz,,Cold Brew Coffee Concentrate,8.99,,,https://www.traderjoes.com/content/dam/trjo/products/m304/50759.png,,,,https://www.traderjoes.com/home/products/pdp/cold-brew-coffee-concentrate-050759,,,,,,,,"{""item_title"":""Cold Brew Coffee Concentrate"",""category_hierarchy"":[{""id"":2,""name"":""Products"",""__typename"":""CategoryTree""},{""id"":182,""name"":""Beverages"",""__typename"":""CategoryTree""},{""id"":194,""name"":""Coffee & Tea"",""__typename"":""CategoryTree""}],""primary_image"":""/content/dam/trjo/products/m304/50759.png"",""primary_image_meta"":{""url"":""/content/dam/trjo/products/m304/50759.png"",""metadata"":""{\""src\"":\""/content/dam/trjo/products/m304/50759.png/jcr:content/renditions/cq5dam.web.1280.1280\"",\""srcSet\"":[{\""src\"":\""/content/dam/trjo/products/m304/50759.png/jcr:content/renditions/webp-640.webp\"",\""media\"":\""(max-width: 847px)\"",\""type\"":\""image/webp\""},{\""src\"":\""/content/dam/trjo/products/m304/50759.png/jcr:content/renditions/webp-1280.webp\"",\""media\"":\""(min-width: 848px)\"",\""type\"":\""image/webp\""},{\""src\"":\""/content/dam/trjo/products/m304/50759.png/jcr:content/renditions/cq5dam.web.640.640\"",\""media\"":\""(max-width: 847px)\"",\""type\"":\""image/png\""},{\""src\"":\""/content/dam/trjo/products/m304/50759.png/jcr:content/renditions/cq5dam.web.1280.1280\"",\""media\"":\""(min-width: 848px)\"",\""type\"":\""image/png\""}],\""srcOriginal\"":\""/content/dam/trjo/products/m304/50759.png\""}"",""__typename"":""ImageWithMeta""},""sales_size"":32,""sales_uom_description"":""Fl Oz"",""price_range"":{""minimum_price"":{""final_price"":{""currency"":""USD"",""value"":8.99,""__typename"":""Money""},""__typename"":""ProductPrice""},""__typename"":""PriceRange""},""fun_tags"":[""Rise & Shine"",""Time-pressed""],""item_characteristics"":[""Kosher""],""__typename"":""SimpleProduct"",""dietaryTags"":"""",""product_variants"":[]}"
"It's time to wake up and smell the coffee. Literally. We named this particular blend of beans Organic Fair Trade 
Wake Up Blend Coffee for a reason-several reasons, actually-but perhaps most important is the fact that this 
is an ideal coffee to greet both your olfactory and gustatory senses first thing in the morning.

Wake Up Blend is a mix of organically grown, fair trade certified, 100% Arabica beans from small-scale farms 
in Mexico, El Salvador, Honduras, and Peru. The farmers who grow these beans are committed to organic and 
sustainable agricultural practices. They're also committed to cultivating truly excellent coffee beans! These high 
quality beans are given a medium roast to bring out their best flavors, yielding a smooth, well-balanced cup 
with bright acidity and just a touch of inherent sweetness. 

As a bonus, we've also given these beans a medium grind. This means that waking up to the aroma and flavor 
of Trader Joe's Organic Fair Trade Wake Up Blend is easier than ever!

Since 2011, we've offered our Wake Up Blend in whole-bean form [sku 98530]. That large, 28-ounce canister is 
still available for $14.99. Now, we're also offering this 14-ounce bag of Trader Joe's Organic Fair Trade Wake 
Up Blend Ground Coffee for $7.49. Find it in our coffee section next to its counterpart.",63980,,14 Oz,,Organic Fair Trade Wake Up Blend Ground Coffee,7.99,,,https://www.traderjoes.com/content/dam/trjo/products/m304/63980.png,,,,https://www.traderjoes.com/home/products/pdp/organic-fair-trade-wake-up-blend-ground-coffee-063980,,,,,,,,"{""item_title"":""Organic Fair Trade Wake Up Blend Ground Coffee"",""category_hierarchy"":[{""id"":2,""name"":""Products"",""__typename"":""CategoryTree""},{""id"":182,""name"":""Beverages"",""__typename"":""CategoryTree""},{""id"":194,""name"":""Coffee & Tea"",""__typename"":""CategoryTree""}],""primary_image"":""/content/dam/trjo/products/m304/63980.png"",""primary_image_meta"":{""url"":""/content/dam/trjo/products/m304/63980.png"",""metadata"":""{\""src\"":\""/content/dam/trjo/products/m304/63980.png/jcr:content/renditions/cq5dam.web.1280.1280\"",\""srcSet\"":[{\""src\"":\""/content/dam/trjo/products/m304/63980.png/jcr:content/renditions/webp-640.webp\"",\""media\"":\""(max-width: 847px)\"",\""type\"":\""image/webp\""},{\""src\"":\""/content/dam/trjo/products/m304/63980.png/jcr:content/renditions/webp-1280.webp\"",\""media\"":\""(min-width: 848px)\"",\""type\"":\""image/webp\""},{\""src\"":\""/content/dam/trjo/products/m304/63980.png/jcr:content/renditions/cq5dam.web.640.640\"",\""media\"":\""(max-width: 847px)\"",\""type\"":\""image/png\""},{\""src\"":\""/content/dam/trjo/products/m304/63980.png/jcr:content/renditions/cq5dam.web.1280.1280\"",\""media\"":\""(min-width: 848px)\"",\""type\"":\""image/png\""}],\""alt\"":\""63980 Org FT Wake Up Blend Ground Coffee\"",\""srcOriginal\"":\""/content/dam/trjo/products/m304/63980.png\""}"",""__typename"":""ImageWithMeta""},""sales_size"":14,""sales_uom_description"":""Oz"",""price_range"":{""minimum_price"":{""final_price"":{""currency"":""USD"",""value"":7.99,""__typename"":""Money""},""__typename"":""ProductPrice""},""__typename"":""PriceRange""},""fun_tags"":[""Rise & Shine""],""item_characteristics"":[""Fair Trade"",""Kosher"",""Organic""],""__typename"":""SimpleProduct"",""dietaryTags"":"""",""product_variants"":[]}"
"It's time to wake up and smell the coffee. Literally. We named this particular blend of beans Organic Fair 
Trade Wake Up Blend Coffee for a reason - well, several reasons, actually, but most important in this 
particular sentence is that this is a great coffee to greet both your olfactory and gustatory senses first thing in 
the morning.

Wake Up Blend is a mix of organically grown, fair trade certified, 100% Arabica Beans from small-scale farms 
in Mexico, El Salvador, Honduras, and Peru. The farmers who grow the beans are committed to organic and 
sustainable agricultural practices. They're also committed to cultivating truly excellent coffee beans. Here, 
those high quality beans are given a medium roast that brings out their best flavors and results in a smooth, 
well-balanced cup with bright acidity and just a touch of inherent sweetness. We like waking up to the aroma 
and flavor of Trader Joe's Organic Fair Trade Wake Up Blend.  

We really like the price of $14.99 for this big, 28 ounce can - a price, by the way, that's remained unchanged 
since 2011! You can make about 105 (standard six ounce) cups of coffee with these beans, making the per-cup 
cost around 14.3 cents. Wake up and smell the value!",98530,,28 Oz,,Organic Fair Trade Wake Up Blend Coffee,16.99,,,https://www.traderjoes.com/content/dam/trjo/products/m304/98530.png,,,,https://www.traderjoes.com/home/products/pdp/organic-fair-trade-wake-up-blend-coffee-098530,,,,,,,,"{""item_title"":""Organic Fair Trade Wake Up Blend Coffee"",""category_hierarchy"":[{""id"":2,""name"":""Products"",""__typename"":""CategoryTree""},{""id"":182,""name"":""Beverages"",""__typename"":""CategoryTree""},{""id"":194,""name"":""Coffee & Tea"",""__typename"":""CategoryTree""}],""primary_image"":""/content/dam/trjo/products/m304/98530.png"",""primary_image_meta"":{""url"":""/content/dam/trjo/products/m304/98530.png"",""metadata"":""{\""src\"":\""/content/dam/trjo/products/m304/98530.png/jcr:content/renditions/cq5dam.web.1280.1280\"",\""srcSet\"":[{\""src\"":\""/content/dam/trjo/products/m304/98530.png/jcr:content/renditions/webp-640.webp\"",\""media\"":\""(max-width: 847px)\"",\""type\"":\""image/webp\""},{\""src\"":\""/content/dam/trjo/products/m304/98530.png/jcr:content/renditions/webp-1280.webp\"",\""media\"":\""(min-width: 848px)\"",\""type\"":\""image/webp\""},{\""src\"":\""/content/dam/trjo/products/m304/98530.png/jcr:content/renditions/cq5dam.web.640.640\"",\""media\"":\""(max-width: 847px)\"",\""type\"":\""image/png\""},{\""src\"":\""/content/dam/trjo/products/m304/98530.png/jcr:content/renditions/cq5dam.web.1280.1280\"",\""media\"":\""(min-width: 848px)\"",\""type\"":\""image/png\""}],\""alt\"":\""Trader Joe’s Organic Fair Trade Wake Up Blend Coffee\"",\""srcOriginal\"":\""/content/dam/trjo/products/m304/98530.png\""}"",""__typename"":""ImageWithMeta""},""sales_size"":28,""sales_uom_description"":""Oz"",""price_range"":{""minimum_price"":{""final_price"":{""currency"":""USD"",""value"":16.99,""__typename"":""Money""},""__typename"":""ProductPrice""},""__typename"":""PriceRange""},""fun_tags"":[""Rise & Shine""],""item_characteristics"":[""Fair Trade"",""Kosher"",""Organic""],""__typename"":""SimpleProduct"",""dietaryTags"":"""",""product_variants"":[]}"
"Tea is important in Japan. It's at the center of communal life, providing a key ritual (literally) around which 
friends can gather. Each fleeting meeting is viewed as a once-in-a-lifetime opportunity, and thus, deeply 
cherished. The common Japanese idiom, Ichi-go, Ichi-e (meaning, ""one time, one meeting"") provides the perfect 
description of this treasured tea time.

We resonate with this value for meaningful human interaction-just visualize your last interaction with one of 
our friendly Crew! So, we're doing our part to help facilitate more such meetings among friends. Toward that 
end, we think our new Matcha Green Tea is a great start. It's hard to find time to slow down and taste the tea 
in your busy routine, but these individual packets of real Matcha Green Tea provide an easy way to brew an 
authentic, quality cup-anytime, anywhere. 

Our vibrant emerald-green tea powder comes from tea leaves that are grown and ground for us in Japan. Brewed, 
it has a rich taste that presents a delicate hint of sweetness. Each 1.5 gram packet (there are seven in the box) is 
the perfect amount to mix with eight ounces of hot water for a steaming cup of Matcha... better make it two! 
Ichi-go, Ichi-e. For cold tea on-the-go, you can simply pour a packet into a water bottle (filled with cold water), 
replace the cap, and shake until blended. 

Per packet, there are zero grams of fat, zero grams of cholesterol, and only five calories. And per packet, you're 
paying less than a dollar since the entire 10.5 gram box of seven is $6.99. If you've been looking for a good 
excuse to come together, look no further than Trader Joe's Matcha Green Tea!

01.23.
17",57159,,0.37 Oz,,Matcha Green Tea Powder,7.99,,,https://www.traderjoes.com/content/dam/trjo/products/m304/57159.png,,,,https://www.traderjoes.com/home/products/pdp/matcha-green-tea-powder-057159,,,,,,,,"{""item_title"":""Matcha Green Tea Powder"",""category_hierarchy"":[{""id"":2,""name"":""Products"",""__typename"":""CategoryTree""},{""id"":182,""name"":""Beverages"",""__typename"":""CategoryTree""},{""id"":194,""name"":""Coffee & Tea"",""__typename"":""CategoryTree""}],""primary_image"":""/content/dam/trjo/products/m304/57159.png"",""primary_image_meta"":{""url"":""/content/dam/trjo/products/m304/57159.png"",""metadata"":""{\""src\"":\""/content/dam/trjo/products/m304/57159.png/jcr:content/renditions/cq5dam.web.1280.1280\"",\""srcSet\"":[{\""src\"":\""/content/dam/trjo/products/m304/57159.png/jcr:content/renditions/webp-640.webp\"",\""media\"":\""(max-width: 847px)\"",\""type\"":\""image/webp\""},{\""src\"":\""/content/dam/trjo/products/m304/57159.png/jcr:content/renditions/webp-1280.webp\"",\""media\"":\""(min-width: 848px)\"",\""type\"":\""image/webp\""},{\""src\"":\""/content/dam/trjo/products/m304/57159.png/jcr:content/renditions/cq5dam.web.640.640\"",\""media\"":\""(max-width: 847px)\"",\""type\"":\""image/png\""},{\""src\"":\""/content/dam/trjo/products/m304/57159.png/jcr:content/renditions/cq5dam.web.1280.1280\"",\""media\"":\""(min-width: 848px)\"",\""type\"":\""image/png\""}],\""srcOriginal\"":\""/content/dam/trjo/products/m304/57159.png\""}"",""__typename"":""ImageWithMeta""},""sales_size"":0.37,""sales_uom_description"":""Oz"",""price_range"":{""minimum_price"":{""final_price"":{""currency"":""USD"",""value"":7.99,""__typename"":""Money""},""__typename"":""ProductPrice""},""__typename"":""PriceRange""},""fun_tags"":[""Feeling Adventurous"",""Glass Half Full""],""item_characteristics"":null,""__typename"":""SimpleProduct"",""dietaryTags"":"""",""product_variants"":[]}"
"When it comes to brewing, what's the difference between hot and cold? Yes, temperature, of course, but also 
bite. Cold brewed coffee is never heated. As a result, the oils and acids that are released commonly with heat 
don't pass through to the brew. No longer masked by the compounds that give coffee its famous bitter bite, the 
nuanced lush, fruity flavors of the beans becomes strikingly more perceptible. With more than 50% less acid 
than a hot brewed cup, cold brew is truly smooth.

While we're pro-DIY, the actual percolation and filtration required for a proper cold brew can take some-
where between 12-24 hours. Don't know about you, but our cup of coffee can't always wait, so we bottled it! 
Working with craft coffee roasters in California, we start with the same medium roast, 100% Arabica bean 
base as our original Cold Brew Coffee Concentrate [sku 50759]. The beans are ground coarsely and specially 
filtered, then something special happens-natural coconut flavors are added to create a bold, smooth tasting, 
tropically-inspired brew-namely, Trader Joe's Coconut Cold Brew Coffee Concentrate.

Mix one part Coconut Cold Brew Concentrate with two parts water or milk, and pour over ice for a lush, 
tropical hot weather treat. If you want to keep the coffee as concentrated as possible, you can use it to make 
coconut coffee ice cubes for your iced coffee. And since it's ideal for adding coffee flavor without the acid bit-
terness, it's great for use in baking, marinating, making cocktails or served Affogato-style over ice cream. 

We're selling 16 fluid ounce bottles (enough for four-12 fluid ounce servings when reconstituted with water, 
milk, etc) of Trader Joe's Coconut Cold Brew Coffee Concentrate for $4.99. You'll find them near our other 
shelf stable coffee products, but only during the summer months.

06.26.
17",60338,,16 Fl Oz,,Coconut Cold Brew Coffee Concentrate,5.99,,,https://www.traderjoes.com/content/dam/trjo/products/m304/60338.png,,,,https://www.traderjoes.com/home/products/pdp/coconut-cold-brew-coffee-concentrate-060338,,,,,,,,"{""item_title"":""Coconut Cold Brew Coffee Concentrate"",""category_hierarchy"":[{""id"":2,""name"":""Products"",""__typename"":""CategoryTree""},{""id"":182,""name"":""Beverages"",""__typename"":""CategoryTree""},{""id"":194,""name"":""Coffee & Tea"",""__typename"":""CategoryTree""}],""primary_image"":""/content/dam/trjo/products/m304/60338.png"",""primary_image_meta"":{""url"":""/content/dam/trjo/products/m304/60338.png"",""metadata"":""{\""src\"":\""/content/dam/trjo/products/m304/60338.png/jcr:content/renditions/cq5dam.web.1280.1280\"",\""srcSet\"":[{\""src\"":\""/content/dam/trjo/products/m304/60338.png/jcr:content/renditions/webp-640.webp\"",\""media\"":\""(max-width: 847px)\"",\""type\"":\""image/webp\""},{\""src\"":\""/content/dam/trjo/products/m304/60338.png/jcr:content/renditions/webp-1280.webp\"",\""media\"":\""(min-width: 848px)\"",\""type\"":\""image/webp\""},{\""src\"":\""/content/dam/trjo/products/m304/60338.png/jcr:content/renditions/cq5dam.web.640.640\"",\""media\"":\""(max-width: 847px)\"",\""type\"":\""image/png\""},{\""src\"":\""/content/dam/trjo/products/m304/60338.png/jcr:content/renditions/cq5dam.web.1280.1280\"",\""media\"":\""(min-width: 848px)\"",\""type\"":\""image/png\""}],\""alt\"":\""Trader Joe's Coconut Cold Brew Coffee Concentrate\"",\""srcOriginal\"":\""/content/dam/trjo/products/m304/60338.png\""}"",""__typename"":""ImageWithMeta""},""sales_size"":16,""sales_uom_description"":""Fl Oz"",""price_range"":{""minimum_price"":{""final_price"":{""currency"":""USD"",""value"":5.99,""__typename"":""Money""},""__typename"":""ProductPrice""},""__typename"":""PriceRange""},""fun_tags"":[""Glass Half Full""],""item_characteristics"":[""Kosher""],""__typename"":""SimpleProduct"",""dietaryTags"":"""",""product_variants"":[]}"
"The most satisfying cup of coffee begins long before you grind and brew at home. It starts with the soil, the 
altitude, the terrain, and the expertise of the farmers who grow the beans. Nestled within this unassuming bag 
of Trader Joe's Select Harvest 50/50 Peaberry Coffee is a blend of exquisite beans from two of the world's 
most exceptional coffee growing regions: the town of Planadas, in Tolima, Colombia; and Mt. Meru, in north-
central Tanzania. 

Peaberry coffee is a rarity, occurring in only about 5-10% of a harvest. Most coffee cherries contain two seeds, 
or beans. Rarely, only one bean develops within the cherry - that bean grows larger and rounder than its two-
beans-in-a-cherry counterparts - and develops distinctive flavors. Together in Trader Joe's Select Harvest 
50/50 Peaberry Coffee, the Colombian and Tanzanian beans combine to form a well-balanced blend that 
delivers full, richly-flavored coffee in every cup. 

Select Harvest 50/50 
Colombia & Tanzania Peaberry Coffee",70672,,13 Oz,,Select Harvest Peaberry Tanzania Columbia,9.99,,,https://www.traderjoes.com/content/dam/trjo/products/m304/70672.png,,,,https://www.traderjoes.com/home/products/pdp/select-harvest-peaberry-tanzania-columbia-070672,,,,,,,,"{""item_title"":""Select Harvest Peaberry Tanzania Columbia"",""category_hierarchy"":[{""id"":2,""name"":""Products"",""__typename"":""CategoryTree""},{""id"":182,""name"":""Beverages"",""__typename"":""CategoryTree""},{""id"":194,""name"":""Coffee & Tea"",""__typename"":""CategoryTree""}],""primary_image"":""/content/dam/trjo/products/m304/70672.png"",""primary_image_meta"":{""url"":""/content/dam/trjo/products/m304/70672.png"",""metadata"":""{\""src\"":\""/content/dam/trjo/products/m304/70672.png/jcr:content/renditions/cq5dam.web.1280.1280\"",\""srcSet\"":[{\""src\"":\""/content/dam/trjo/products/m304/70672.png/jcr:content/renditions/webp-640.webp\"",\""media\"":\""(max-width: 847px)\"",\""type\"":\""image/webp\""},{\""src\"":\""/content/dam/trjo/products/m304/70672.png/jcr:content/renditions/webp-1280.webp\"",\""media\"":\""(min-width: 848px)\"",\""type\"":\""image/webp\""},{\""src\"":\""/content/dam/trjo/products/m304/70672.png/jcr:content/renditions/cq5dam.web.640.640\"",\""media\"":\""(max-width: 847px)\"",\""type\"":\""image/png\""},{\""src\"":\""/content/dam/trjo/products/m304/70672.png/jcr:content/renditions/cq5dam.web.1280.1280\"",\""media\"":\""(min-width: 848px)\"",\""type\"":\""image/png\""}],\""alt\"":\""Select Harvest Peaberry Columbia/Tanzania Coffee\"",\""srcOriginal\"":\""/content/dam/trjo/products/m304/70672.png\""}"",""__typename"":""ImageWithMeta""},""sales_size"":13,""sales_uom_description"":""Oz"",""price_range"":{""minimum_price"":{""final_price"":{""currency"":""USD"",""value"":9.99,""__typename"":""Money""},""__typename"":""ProductPrice""},""__typename"":""PriceRange""},""fun_tags"":[""Glass Half Full""],""item_characteristics"":[""Kosher""],""__typename"":""SimpleProduct"",""dietaryTags"":"""",""product_variants"":[]}"
