description,sku,pack,size,gtin,name,retail_price,is_catch_weight,average_case_weight,image,manufacturer_sku,ordering_unit,is_broken_case,content_url,brand,level_1,level_2,level_3,manufacturer_name,distributor_name,unit_price,extra_data
"Those rumors brewing across the land are true: Trader Joe's French Roast has got a brand new bag! Brought to 
us by a new supplier, whose increased efficiencies (including the change to a bag, rather than a canister) allow 
us to offer this rich, super dark-roasted whole bean coffee for a signifcantly lower retail, our new French Roast 
is nothing if not buzz-worthy. It's made with a blend of 100% Arabica beans from Peru and Brazil, which, when 
made into drip, pour-over, or even cold brew coffee, creates a rich, robust cup with notes of cacao, baking spice, 
and toasted pecans.

So, what precisely makes a coffee blend with Peruvian and Brazilian beans a French Roast? The ""French"" 
actually refers to the level of roast, rather than its geographical provenance. While food historians aren't entirely 
certain when and where the term originated, it's very likely a reference to the fact that, in the 19th century, 
super dark-roasted coffee was all the rage in French cafés. One sip of our French Roast, and it's easy to see 
why: in addition to imparting a deep, dark hue to the beans, the extra roasting time also intensifies its sweet, 
chocolatey aromatics, and heightens the nuttiness and spice on the palate. 

French Roast Coffee",77083,,13 Oz,,French Roast Whole Bean Coffee,5.99,,,https://www.traderjoes.com/content/dam/trjo/products/m304/77083.png,,,,https://www.traderjoes.com/home/products/pdp/french-roast-whole-bean-coffee-077083,,,,,,,,"{""item_title"":""French Roast Whole Bean Coffee"",""category_hierarchy"":[{""id"":2,""name"":""Products"",""__typename"":""CategoryTree""},{""id"":182,""name"":""Beverages"",""__typename"":""CategoryTree""},{""id"":194,""name"":""Coffee & Tea"",""__typename"":""CategoryTree""}],""primary_image"":""/content/dam/trjo/products/m304/77083.png"",""primary_image_meta"":{""url"":""/content/dam/trjo/products/m304/77083.png"",""metadata"":""{\""src\"":\""/content/dam/trjo/products/m304/77083.png/jcr:content/renditions/cq5dam.web.1280.1280\"",\""srcSet\"":[{\""src\"":\""/content/dam/trjo/products/m304/77083.png/jcr:content/renditions/webp-640.webp\"",\""media\"":\""(max-width: 847px)\"",\""type\"":\""image/webp\""},{\""src\"":\""/content/dam/trjo/products/m304/77083.png/jcr:content/renditions/webp-1280.webp\"",\""media\"":\""(min-width: 848px)\"",\""type\"":\""image/webp\""},{\""src\"":\""/content/dam/trjo/products/m304/77083.png/jcr:content/renditions/cq5dam.web.640.640\"",\""media\"":\""(max-width: 847px)\"",\""type\"":\""image/png\""},{\""src\"":\""/content/dam/trjo/products/m304/77083.png/jcr:content/renditions/cq5dam.web.1280.1280\"",\""media\"":\""(min-width: 848px)\"",\""type\"":\""image/png\""}],\""alt\"":\""Trader Joe's French Roast Coffee\"",\""srcOriginal\"":\""/content/dam/trjo/products/m304/77083.png\""}"",""__typename"":""ImageWithMeta""},""sales_size"":13,""sales_uom_description"":""Oz"",""price_range"":{""minimum_price"":{""final_price"":{""currency"":""USD"",""value"":5.99,""__typename"":""Money""},""__typename"":""ProductPrice""},""__typename"":""PriceRange""},""fun_tags"":[""Alfresco Dining"",""Brunch All Day"",""Rise & Shine""],""item_characteristics"":[""Kosher""],""__typename"":""SimpleProduct"",""dietaryTags"":"""",""product_variants"":[]}"
"Sourced from Guatemala, Indonesia, Honduras, Mexico, and Peru, Trader Joe's Fairtrade Organic Five 
Country Blend is a global coffee bean tour in a bag. Each country contributes something unique to this bold, 
well-balanced, whole bean Blend: the Guatemalan beans offer notes of toasted almonds and chocolate; the 
Indonesian beans add earthiness and spiciness; the Honduran beans bring depth and body; the Mexican beans 
supply subtle, fruity undertones; and the Peruvian beans lend a lively, medium acidity. As one of our darkest, 
richest roasts, it's excellent for making everything from espresso, to pour-over, to French press.

Long-time Five Country fans may recall the previous canister of Five Country Espresso Blend [sku 55790] 
offered on shelves-it had an admittedly limiting moniker, as ""Espresso"" referenced a single coffee preparation 
instead of the numerous ways a dark roast coffee can be ground, brewed and enjoyed. Our new Five Country 
Blend maintains the beloved flavor profile and bean origins of its predecessor, is still Organic and kosher 
(pareve)-certified, and holds Fairtrade certification, guaranteeing small-scale growers are given a fair price for 
their harvest. And speaking of a fair price, great news: increased efficiencies with our new supplier (along with 
the new packaging) mean we get to pass significant savings along to you! 

Organic Five Country Blend",75122,,13 Oz,,Fairtrade Organic Five Country Blend,6.99,,,https://www.traderjoes.com/content/dam/trjo/products/m304/75122.png,,,,https://www.traderjoes.com/home/products/pdp/fairtrade-organic-five-country-blend-075122,,,,,,,,"{""item_title"":""Fairtrade Organic Five Country Blend"",""category_hierarchy"":[{""id"":2,""name"":""Products"",""__typename"":""CategoryTree""},{""id"":182,""name"":""Beverages"",""__typename"":""CategoryTree""},{""id"":194,""name"":""Coffee & Tea"",""__typename"":""CategoryTree""}],""primary_image"":""/content/dam/trjo/products/m304/75122.png"",""primary_image_meta"":{""url"":""/content/dam/trjo/products/m304/75122.png"",""metadata"":""{\""src\"":\""/content/dam/trjo/products/m304/75122.png/jcr:content/renditions/cq5dam.web.1280.1280\"",\""srcSet\"":[{\""src\"":\""/content/dam/trjo/products/m304/75122.png/jcr:content/renditions/webp-640.webp\"",\""media\"":\""(max-width: 847px)\"",\""type\"":\""image/webp\""},{\""src\"":\""/content/dam/trjo/products/m304/75122.png/jcr:content/renditions/webp-1280.webp\"",\""media\"":\""(min-width: 848px)\"",\""type\"":\""image/webp\""},{\""src\"":\""/content/dam/trjo/products/m304/75122.png/jcr:content/renditions/cq5dam.web.640.640\"",\""media\"":\""(max-width: 847px)\"",\""type\"":\""image/png\""},{\""src\"":\""/content/dam/trjo/products/m304/75122.png/jcr:content/renditions/cq5dam.web.1280.1280\"",\""media\"":\""(min-width: 848px)\"",\""type\"":\""image/png\""}],\""alt\"":\""Trader Joe's Fairtrade Organic Five Country Blend\"",\""srcOriginal\"":\""/content/dam/trjo/products/m304/75122.png\""}"",""__typename"":""ImageWithMeta""},""sales_size"":13,""sales_uom_description"":""Oz"",""price_range"":{""minimum_price"":{""final_price"":{""currency"":""USD"",""value"":6.99,""__typename"":""Money""},""__typename"":""ProductPrice""},""__typename"":""PriceRange""},""fun_tags"":[""Alfresco Dining"",""Brunch All Day"",""Rise & Shine""],""item_characteristics"":[""Fair Trade"",""Organic"",""Kosher""],""__typename"":""SimpleProduct"",""dietaryTags"":"""",""product_variants"":[]}"
"Hailing from the Yirgacheffe region of Ethiopia, Trader Joe's FTO Shade Grown Ethiopian Coffee is a medium 
dark roast blend straight out of this birthplace of coffee.  It is within the forests of the Kaffa region that arabica 
coffee was first found growing wild. 

This coffee has got it all - it's USDA organic, shade grown, and fair trade certified which supports fair sale prices 
given to farmers for the 100% arabica green beans they grow so well. And grown under a canopy of trees, our 
FTO Shade Grown Ethiopian Coffee is grown nestling itself amongst a diverse habitat in its natural setting 
as opposed to many modern, sun-tolerant coffee plants that are grown in direct sunlight. All of this comes 
together in harmony to receive its medium dark roasting to give a rich tasting, medium bodied coffee that 
takes on a slightly acidic tartness and floral aroma. The beans are then packaged immediately and the canister 
nitrogen flushed to help ensure the freshest beans are what you smell when you get home and peel back the 
freshness seal.

 *Please check QIL to confirm current pricing.

Organic Fair Trade Shade Grown 
Ethiopian Coffee",81741,,13 Oz,,Organic Fair Trade Shade Grown Ethiopian Coffee,8.99,,,https://www.traderjoes.com/content/dam/trjo/products/m304/81741.png,,,,https://www.traderjoes.com/home/products/pdp/organic-fair-trade-shade-grown-ethiopian-coffee-081741,,,,,,,,"{""item_title"":""Organic Fair Trade Shade Grown Ethiopian Coffee"",""category_hierarchy"":[{""id"":2,""name"":""Products"",""__typename"":""CategoryTree""},{""id"":182,""name"":""Beverages"",""__typename"":""CategoryTree""},{""id"":194,""name"":""Coffee & Tea"",""__typename"":""CategoryTree""}],""primary_image"":""/content/dam/trjo/products/m304/81741.png"",""primary_image_meta"":{""url"":""/content/dam/trjo/products/m304/81741.png"",""metadata"":""{\""src\"":\""/content/dam/trjo/products/m304/81741.png/jcr:content/renditions/cq5dam.web.1280.1280\"",\""srcSet\"":[{\""src\"":\""/content/dam/trjo/products/m304/81741.png/jcr:content/renditions/webp-640.webp\"",\""media\"":\""(max-width: 847px)\"",\""type\"":\""image/webp\""},{\""src\"":\""/content/dam/trjo/products/m304/81741.png/jcr:content/renditions/webp-1280.webp\"",\""media\"":\""(min-width: 848px)\"",\""type\"":\""image/webp\""},{\""src\"":\""/content/dam/trjo/products/m304/81741.png/jcr:content/renditions/cq5dam.web.640.640\"",\""media\"":\""(max-width: 847px)\"",\""type\"":\""image/png\""},{\""src\"":\""/content/dam/trjo/products/m304/81741.png/jcr:content/renditions/cq5dam.web.1280.1280\"",\""media\"":\""(min-width: 848px)\"",\""type\"":\""image/png\""}],\""alt\"":\""Trader Joe's Organic Fair Trade Shade Grown Ethiopian Coffee\"",\""srcOriginal\"":\""/content/dam/trjo/products/m304/81741.png\""}"",""__typename"":""ImageWithMeta""},""sales_size"":13,""sales_uom_description"":""Oz"",""price_range"":{""minimum_price"":{""final_price"":{""currency"":""USD"",""value"":8.99,""__typename"":""Money""},""__typename"":""ProductPrice""},""__typename"":""PriceRange""},""fun_tags"":[""Alfresco Dining"",""Brunch All Day"",""Rise & Shine""],""item_characteristics"":[""Fair Trade"",""Kosher"",""Organic""],""__typename"":""SimpleProduct"",""dietaryTags"":"""",""product_variants"":[]}"
"Given that people have been growing, brewing, and enjoying coffee for over five hundred years, one might 
expect that we've already learned everything there is to know about the coffee bean. Well, the newest entry into 
our Small Lot Coffee series proves that simply isn't so. Hailing from Brazil's Vale da Grama (literally ""Valley of 
Grass""), a coffee region renowned for its well-balanced and citric coffees, Trader Joe's Cachoeira da Grama 
Small Lot Coffee (so named for an iconic waterfall, or cachoeira, near our supplier) is the product of pure 
innovation. To make each batch, our supplier employs an ingenious double-fermentation process, where beans 
are first fermented in open air tanks, then again in airtight barrels to create lush, vibrant, and superlatively 
smooth flavor profile.

It's a difference you can taste in every cup of Cachoeira da Grama: each sip starts with aromas of citrus leaves 
and ripe fruit, which leads into balanced flavors of dried plum and orange zest, and eventually into a long, lazy 
finish. An excellent candidate for preparing via French press or enjoyed as pour over, Cachoeira da Grama 
mixes marvelously well with milk or your favorite non-dairy creamer, and pairs especially well with breakfast 
pastries, brunch fare, and toffee-like candies, like our Pecan Pralines [sku 28077]. Supplies are limited, so be 
sure to grab this double-fermented Small Lot Coffee on the double!

Cachoeira da Grama Brazil
Small Lot Coffee",75389,,12 Oz,,Brazil Cachoeira da Grama Small Lot Coffee,9.99,,,https://www.traderjoes.com/content/dam/trjo/products/m304/75389.png,,,,https://www.traderjoes.com/home/products/pdp/brazil-cachoeira-da-grama-small-lot-coffee-075389,,,,,,,,"{""item_title"":""Brazil Cachoeira da Grama Small Lot Coffee"",""category_hierarchy"":[{""id"":2,""name"":""Products"",""__typename"":""CategoryTree""},{""id"":182,""name"":""Beverages"",""__typename"":""CategoryTree""},{""id"":194,""name"":""Coffee & Tea"",""__typename"":""CategoryTree""}],""primary_image"":""/content/dam/trjo/products/m304/75389.png"",""primary_image_meta"":{""url"":""/content/dam/trjo/products/m304/75389.png"",""metadata"":""{\""src\"":\""/content/dam/trjo/products/m304/75389.png/jcr:content/renditions/cq5dam.web.1280.1280\"",\""srcSet\"":[{\""src\"":\""/content/dam/trjo/products/m304/75389.png/jcr:content/renditions/webp-640.webp\"",\""media\"":\""(max-width: 847px)\"",\""type\"":\""image/webp\""},{\""src\"":\""/content/dam/trjo/products/m304/75389.png/jcr:content/renditions/webp-1280.webp\"",\""media\"":\""(min-width: 848px)\"",\""type\"":\""image/webp\""},{\""src\"":\""/content/dam/trjo/products/m304/75389.png/jcr:content/renditions/cq5dam.web.640.640\"",\""media\"":\""(max-width: 847px)\"",\""type\"":\""image/png\""},{\""src\"":\""/content/dam/trjo/products/m304/75389.png/jcr:content/renditions/cq5dam.web.1280.1280\"",\""media\"":\""(min-width: 848px)\"",\""type\"":\""image/png\""}],\""alt\"":\""Trader Joe's Brazil Cachoeira da Grama Small Lot Coffee\"",\""srcOriginal\"":\""/content/dam/trjo/products/m304/75389.png\""}"",""__typename"":""ImageWithMeta""},""sales_size"":12,""sales_uom_description"":""Oz"",""price_range"":{""minimum_price"":{""final_price"":{""currency"":""USD"",""value"":9.99,""__typename"":""Money""},""__typename"":""ProductPrice""},""__typename"":""PriceRange""},""fun_tags"":[""Alfresco Dining"",""Brunch All Day"",""Glass Half Full"",""Rise & Shine""],""item_characteristics"":[""Kosher""],""__typename"":""SimpleProduct"",""dietaryTags"":"""",""product_variants"":[]}"
"Located in the northeastern corner of India, Darjeeling is known for its beautiful Buddhist and Hindu temples, 
dramatic mountain vistas, and, of course, its tea. Blessed with a mild, subtropical climate, and dizzying 4,000-
foot elevation, Darjeeling has some of the best conditions on the planet for growing tea leaves, producing 
blends marked with an elegantly delicate sweetness and herby, refreshing aroma. In fact, Darjeeling is often 
called ""the Champagne of teas,"" which is certainly an apt comparison point for our fine, bright, and lightly 
fruity Trader Joe's Organic Darjeeling Green Tea. (Except for the bubbles, of course.)

Naturally sweet and rich in antioxidants, our Organic Darjeeling Green Tea serves just as well as a special 
occasion kind of tea, with cucumber sandwiches and Macarons [sku 51604], as it does your everyday cuppa. 
We're particularly fond of enjoying it as a morning or afternoon pickmeup, especially when paired with pastries, 
fruits, or mild and tangy fare: think fresh cut melon, a slice of French Apple Tart [sku 57284], or slices of apple 
spread with a bit of Fine Herbs Chevre [sku 88544]. 

Organic Darjeeling Green Tea",74753,,48 Bag,,Organic Darjeeling Green Tea,4.49,,,https://www.traderjoes.com/content/dam/trjo/products/m304/74753.png,,,,https://www.traderjoes.com/home/products/pdp/organic-darjeeling-green-tea-074753,,,,,,,,"{""item_title"":""Organic Darjeeling Green Tea"",""category_hierarchy"":[{""id"":2,""name"":""Products"",""__typename"":""CategoryTree""},{""id"":182,""name"":""Beverages"",""__typename"":""CategoryTree""},{""id"":194,""name"":""Coffee & Tea"",""__typename"":""CategoryTree""}],""primary_image"":""/content/dam/trjo/products/m304/74753.png"",""primary_image_meta"":{""url"":""/content/dam/trjo/products/m304/74753.png"",""metadata"":""{\""src\"":\""/content/dam/trjo/products/m304/74753.png/jcr:content/renditions/cq5dam.web.1280.1280\"",\""srcSet\"":[{\""src\"":\""/content/dam/trjo/products/m304/74753.png/jcr:content/renditions/webp-640.webp\"",\""media\"":\""(max-width: 847px)\"",\""type\"":\""image/webp\""},{\""src\"":\""/content/dam/trjo/products/m304/74753.png/jcr:content/renditions/webp-1280.webp\"",\""media\"":\""(min-width: 848px)\"",\""type\"":\""image/webp\""},{\""src\"":\""/content/dam/trjo/products/m304/74753.png/jcr:content/renditions/cq5dam.web.640.640\"",\""media\"":\""(max-width: 847px)\"",\""type\"":\""image/png\""},{\""src\"":\""/content/dam/trjo/products/m304/74753.png/jcr:content/renditions/cq5dam.web.1280.1280\"",\""media\"":\""(min-width: 848px)\"",\""type\"":\""image/png\""}],\""alt\"":\""Trader Joe's Organic Darjeeling Green Tea\"",\""srcOriginal\"":\""/content/dam/trjo/products/m304/74753.png\""}"",""__typename"":""ImageWithMeta""},""sales_size"":48,""sales_uom_description"":""Bag"",""price_range"":{""minimum_price"":{""final_price"":{""currency"":""USD"",""value"":4.49,""__typename"":""Money""},""__typename"":""ProductPrice""},""__typename"":""PriceRange""},""fun_tags"":[""Alfresco Dining"",""Cold Front"",""Desk Drawer"",""Glass Half Full"",""Rain or Shine"",""Rise & Shine""],""item_characteristics"":[""Organic""],""__typename"":""SimpleProduct"",""dietaryTags"":"""",""product_variants"":[]}"
"One typically hears the term ""terroir"" used exclusively in relation to wine-and yet, this concept of climate and 
terrain being indicative of flavor is just as applicable to coffee. The beans in each bag of our limited-edition 
Trader Joe's Guatemala La Morena Peaberry Small Lot Coffee, for example, hail from the women-owned La 
Morena collective of farms, situated near the city of Huehuetenango in western Guatemala. Here, the region's 
warm, humid, subtropical climate and lush, limestone soils make ideal growing conditions for crafting this 
rich, chocolatey, and superlatively smooth coffee-the kind that conjures the character of its terroir with every 
satisfying sip.

In addition to its impressive provenance, the makers of this Small Lot Coffee have also ensured that each bag 
contains only the very best of the very best coffee beans from their harvest. While there are usually two beans 
in each coffee cherry, approximately 5% of coffee crops yield Peaberry beans, which are smaller and prized for 
their concentrated flavors. In these Peaberry beans, those flavors express themselves as dark chocolate, ripe 
blackberry, and a sweet, cozy finishing note of brown sugar. We recommend enjoying each cup in a context 
where you can slowly savor every sip, like paired with a flaky pastry, avocado toast, or a few squares of our Dark 
Chocolate Bar with Almonds [sku 90725].

Guatemala La Morena
Peaberry Small Lot Coffee",75106,,12 Oz,,Guatemala La Morena Peaberry Small Lot Coffee,10.99,,,https://www.traderjoes.com/content/dam/trjo/products/m304/75106.png,,,,https://www.traderjoes.com/home/products/pdp/guatemala-la-morena-peaberry-small-lot-coffee-075106,,,,,,,,"{""item_title"":""Guatemala La Morena Peaberry Small Lot Coffee"",""category_hierarchy"":[{""id"":2,""name"":""Products"",""__typename"":""CategoryTree""},{""id"":182,""name"":""Beverages"",""__typename"":""CategoryTree""},{""id"":194,""name"":""Coffee & Tea"",""__typename"":""CategoryTree""}],""primary_image"":""/content/dam/trjo/products/m304/75106.png"",""primary_image_meta"":{""url"":""/content/dam/trjo/products/m304/75106.png"",""metadata"":""{\""src\"":\""/content/dam/trjo/products/m304/75106.png/jcr:content/renditions/cq5dam.web.1280.1280\"",\""srcSet\"":[{\""src\"":\""/content/dam/trjo/products/m304/75106.png/jcr:content/renditions/webp-640.webp\"",\""media\"":\""(max-width: 847px)\"",\""type\"":\""image/webp\""},{\""src\"":\""/content/dam/trjo/products/m304/75106.png/jcr:content/renditions/webp-1280.webp\"",\""media\"":\""(min-width: 848px)\"",\""type\"":\""image/webp\""},{\""src\"":\""/content/dam/trjo/products/m304/75106.png/jcr:content/renditions/cq5dam.web.640.640\"",\""media\"":\""(max-width: 847px)\"",\""type\"":\""image/png\""},{\""src\"":\""/content/dam/trjo/products/m304/75106.png/jcr:content/renditions/cq5dam.web.1280.1280\"",\""media\"":\""(min-width: 848px)\"",\""type\"":\""image/png\""}],\""alt\"":\""Trader Joe's Guatemala La Morena Peaberry Small Lot Coffee\"",\""srcOriginal\"":\""/content/dam/trjo/products/m304/75106.png\""}"",""__typename"":""ImageWithMeta""},""sales_size"":12,""sales_uom_description"":""Oz"",""price_range"":{""minimum_price"":{""final_price"":{""currency"":""USD"",""value"":10.99,""__typename"":""Money""},""__typename"":""ProductPrice""},""__typename"":""PriceRange""},""fun_tags"":[""A Long Finish"",""Brunch All Day"",""Rise & Shine""],""item_characteristics"":[""Kosher""],""__typename"":""SimpleProduct"",""dietaryTags"":"""",""product_variants"":[]}"
"We're big fans of hot chocolate. But this isn't hot chocolate. It's better! Big claim, we know, but Trader Joe's 
Sipping Chocolate really puts the ""chocolate"" in sipping chocolate.

¿ is rich, deep, dark chocolate was inspired by memories of relaxing in an outdoor European café, sipping 
velvety-smooth warm chocolate from a demitasse. Trader Joe's Sipping Chocolate was created with sipping 
in mind (in case you were wondering). Its chocolate ¿ avors are so deep and rich that it really does invite you 
to savor every drop. You can make it with water or milk. We think whole milk is what you want to use for the 
creamiest texture and greatest chocolate depths. It's the holidays, so indulge a little.

Each nine-ounce tin of Trader Joe's Sipping Chocolate contains just four, simple ingredients: sugar, cocoa, 
natural ¿ avor (from soy), and a bit of salt. Simple, yet decadent. Flavorful, yet re¿ ned. ¿ is is grown-up hot 
chocolate. 

Indulge in a cup any time you need an excuse to relax, or enjoy it with a Chocolate Danish or Petit Fours. Share 
a cup or gi¿  the entire tin as an expression of friendship and fondness-it's really lovely, really rich, wondrous 
chocolate. And speaking of wondrous, we're selling a nine-ounce tin of Sipping Chocolate for just $3.99. Happy 
sipping.",88861,,9 Oz,,Sipping Chocolate,5.99,,,https://www.traderjoes.com/content/dam/trjo/products/m304/88861.png,,,,https://www.traderjoes.com/home/products/pdp/sipping-chocolate-088861,,,,,,,,"{""item_title"":""Sipping Chocolate"",""category_hierarchy"":[{""id"":2,""name"":""Products"",""__typename"":""CategoryTree""},{""id"":182,""name"":""Beverages"",""__typename"":""CategoryTree""},{""id"":194,""name"":""Coffee & Tea"",""__typename"":""CategoryTree""}],""primary_image"":""/content/dam/trjo/products/m304/88861.png"",""primary_image_meta"":{""url"":""/content/dam/trjo/products/m304/88861.png"",""metadata"":""{\""src\"":\""/content/dam/trjo/products/m304/88861.png/jcr:content/renditions/cq5dam.web.1280.1280\"",\""srcSet\"":[{\""src\"":\""/content/dam/trjo/products/m304/88861.png/jcr:content/renditions/webp-640.webp\"",\""media\"":\""(max-width: 847px)\"",\""type\"":\""image/webp\""},{\""src\"":\""/content/dam/trjo/products/m304/88861.png/jcr:content/renditions/webp-1280.webp\"",\""media\"":\""(min-width: 848px)\"",\""type\"":\""image/webp\""},{\""src\"":\""/content/dam/trjo/products/m304/88861.png/jcr:content/renditions/cq5dam.web.640.640\"",\""media\"":\""(max-width: 847px)\"",\""type\"":\""image/png\""},{\""src\"":\""/content/dam/trjo/products/m304/88861.png/jcr:content/renditions/cq5dam.web.1280.1280\"",\""media\"":\""(min-width: 848px)\"",\""type\"":\""image/png\""}],\""alt\"":\""Trader Joe's Sipping Chocolate\"",\""srcOriginal\"":\""/content/dam/trjo/products/m304/88861.png\""}"",""__typename"":""ImageWithMeta""},""sales_size"":9,""sales_uom_description"":""Oz"",""price_range"":{""minimum_price"":{""final_price"":{""currency"":""USD"",""value"":5.99,""__typename"":""Money""},""__typename"":""ProductPrice""},""__typename"":""PriceRange""},""fun_tags"":null,""item_characteristics"":[""Kosher""],""__typename"":""SimpleProduct"",""dietaryTags"":"""",""product_variants"":[]}"
