description,sku,pack,size,gtin,name,retail_price,is_catch_weight,average_case_weight,image,manufacturer_sku,ordering_unit,is_broken_case,content_url,brand,level_1,level_2,level_3,manufacturer_name,distributor_name,unit_price,extra_data
"For so many, coffee is an essential part of the morning. Even coffee drinkers who opt for decaf swear by the 
inherent perking-power of a good cup of Joe, whether that's first thing in the morning, mid-afternoon, or after 
dinner alongside dessert.

Our house blend decaffeinated coffee, Trader Joe's Joe Medium Roast Decaf, is already available in single-
serve cup forms [sku 62369]. Now, we're offering it in Ground form, too! It's the same medium-roasted, water-
processed, 100% Arabica Decaf Coffee that you're used to. But different. Because it's ground. No bean-grinding, 
extra packaging, or complicated brewing here, folks!

For the perfect cup, use approximately two tablespoons of ground coffee for each six fluid ounces of cold water. 
Add your favorite accoutrements and-voila!-morning made.

Decaf Joe Medium Roast Ground Coffee",73059,,14 Oz,,Decaf Joe Medium Roast Ground Coffee,6.99,,,https://www.traderjoes.com/content/dam/trjo/products/m304/73059.png,,,,https://www.traderjoes.com/home/products/pdp/decaf-joe-medium-roast-ground-coffee-073059,,,,,,,,"{""item_title"":""Decaf Joe Medium Roast Ground Coffee"",""category_hierarchy"":[{""id"":2,""name"":""Products"",""__typename"":""CategoryTree""},{""id"":182,""name"":""Beverages"",""__typename"":""CategoryTree""},{""id"":194,""name"":""Coffee & Tea"",""__typename"":""CategoryTree""}],""primary_image"":""/content/dam/trjo/products/m304/73059.png"",""primary_image_meta"":{""url"":""/content/dam/trjo/products/m304/73059.png"",""metadata"":""{\""src\"":\""/content/dam/trjo/products/m304/73059.png/jcr:content/renditions/cq5dam.web.1280.1280\"",\""srcSet\"":[{\""src\"":\""/content/dam/trjo/products/m304/73059.png/jcr:content/renditions/webp-640.webp\"",\""media\"":\""(max-width: 847px)\"",\""type\"":\""image/webp\""},{\""src\"":\""/content/dam/trjo/products/m304/73059.png/jcr:content/renditions/webp-1280.webp\"",\""media\"":\""(min-width: 848px)\"",\""type\"":\""image/webp\""},{\""src\"":\""/content/dam/trjo/products/m304/73059.png/jcr:content/renditions/cq5dam.web.640.640\"",\""media\"":\""(max-width: 847px)\"",\""type\"":\""image/png\""},{\""src\"":\""/content/dam/trjo/products/m304/73059.png/jcr:content/renditions/cq5dam.web.1280.1280\"",\""media\"":\""(min-width: 848px)\"",\""type\"":\""image/png\""}],\""alt\"":\""Trader Joe's Decaf Joe Medium Roast Ground Coffee\"",\""srcOriginal\"":\""/content/dam/trjo/products/m304/73059.png\""}"",""__typename"":""ImageWithMeta""},""sales_size"":14,""sales_uom_description"":""Oz"",""price_range"":{""minimum_price"":{""final_price"":{""currency"":""USD"",""value"":6.99,""__typename"":""Money""},""__typename"":""ProductPrice""},""__typename"":""PriceRange""},""fun_tags"":[""Alfresco Dining"",""Brunch All Day"",""Rise & Shine""],""item_characteristics"":[""Kosher""],""__typename"":""SimpleProduct"",""dietaryTags"":"""",""product_variants"":[]}"
"With all the holiday hustle and bustle, sometimes you just need a few moments in a comfy chair with a
warm mug of hot coffee in your hands. The latest of our Small Lot Coffee offerings really evokes the flavors 
of the season. Creamy milk chocolate and sweet, dried figs, cut with bright notes of tangelos-that certainly 
sounds like the holidays in a sip, minus the lengthy to-do list. 

Trader Joe's Indian Pearl Mountain Small Lot Coffee is grown on a biodynamic estate that's tucked away on 
the slopes of Western Ghats of South India. The Catuai varietal, 100% Arabica beans, are shade-grown and 
undergo a 25-day slow-drying process that intensifies the flavors of this medium roast, delivering on the flavor 
promise in every brewed cup.

Whether you have time to perfect your pour-over process, or just enough to press the start button, Trader 
Joe's Indian Pearl Mountain Small Lot Coffee is a sensational way to start your day... or the day of someone 
on your list, perhaps? We're selling each 12-ounce bag for $9.99, while supplies last. You'll find it in our coffee 
and tea section.

Indian Pearl Mountain
Small Lot Coffee",72788,,12 Oz,,Indian Pearl Mountain Small Lot Coffee,9.99,,,https://www.traderjoes.com/content/dam/trjo/products/m304/72788.png,,,,https://www.traderjoes.com/home/products/pdp/indian-pearl-mountain-small-lot-coffee-072788,,,,,,,,"{""item_title"":""Indian Pearl Mountain Small Lot Coffee"",""category_hierarchy"":[{""id"":2,""name"":""Products"",""__typename"":""CategoryTree""},{""id"":182,""name"":""Beverages"",""__typename"":""CategoryTree""},{""id"":194,""name"":""Coffee & Tea"",""__typename"":""CategoryTree""}],""primary_image"":""/content/dam/trjo/products/m304/72788.png"",""primary_image_meta"":{""url"":""/content/dam/trjo/products/m304/72788.png"",""metadata"":""{\""src\"":\""/content/dam/trjo/products/m304/72788.png/jcr:content/renditions/cq5dam.web.1280.1280\"",\""srcSet\"":[{\""src\"":\""/content/dam/trjo/products/m304/72788.png/jcr:content/renditions/webp-640.webp\"",\""media\"":\""(max-width: 847px)\"",\""type\"":\""image/webp\""},{\""src\"":\""/content/dam/trjo/products/m304/72788.png/jcr:content/renditions/webp-1280.webp\"",\""media\"":\""(min-width: 848px)\"",\""type\"":\""image/webp\""},{\""src\"":\""/content/dam/trjo/products/m304/72788.png/jcr:content/renditions/cq5dam.web.640.640\"",\""media\"":\""(max-width: 847px)\"",\""type\"":\""image/png\""},{\""src\"":\""/content/dam/trjo/products/m304/72788.png/jcr:content/renditions/cq5dam.web.1280.1280\"",\""media\"":\""(min-width: 848px)\"",\""type\"":\""image/png\""}],\""alt\"":\""Trader Joe's Indian Pearl Mountain Small Lot Coffee\"",\""srcOriginal\"":\""/content/dam/trjo/products/m304/72788.png\""}"",""__typename"":""ImageWithMeta""},""sales_size"":12,""sales_uom_description"":""Oz"",""price_range"":{""minimum_price"":{""final_price"":{""currency"":""USD"",""value"":9.99,""__typename"":""Money""},""__typename"":""ProductPrice""},""__typename"":""PriceRange""},""fun_tags"":[""Alfresco Dining"",""Brunch All Day"",""Glass Half Full"",""Rise & Shine""],""item_characteristics"":[""Kosher""],""__typename"":""SimpleProduct"",""dietaryTags"":"""",""product_variants"":[]}"
"Back by popular demand, Trader Joe's Gingerbread Coffee is our ode to winter. We start with a quality 
blend of 100% arabica beans from Colombia and Mexico that are roasted to a medium-dark Vienna roast.  
Then we spike the blend with cinnamon, nutmeg, cloves, allspice and ginger. We grind the beans and spices 
together, which adds dynamic aroma and flavor to the coffee. It makes a cup of coffee that drinks like a 
freshly baked piece of gingerbread - as delicious and heartwarming as it sounds. The spices are just right, 
zingy but not too overpowering. 

Whether pouring a wake-up cup or post-dinner brew for your favorite crew, Trader Joe's Gingerbread 
Coffee definitely gets you in the holiday spirit, especially at our price of $6.99 for each 14 ounce can.",91180,,14 Oz,,Gingerbread Coffee,8.99,,,https://www.traderjoes.com/content/dam/trjo/products/m304/91180.png,,,,https://www.traderjoes.com/home/products/pdp/gingerbread-coffee-091180,,,,,,,,"{""item_title"":""Gingerbread Coffee"",""category_hierarchy"":[{""id"":2,""name"":""Products"",""__typename"":""CategoryTree""},{""id"":182,""name"":""Beverages"",""__typename"":""CategoryTree""},{""id"":194,""name"":""Coffee & Tea"",""__typename"":""CategoryTree""}],""primary_image"":""/content/dam/trjo/products/m304/91180.png"",""primary_image_meta"":{""url"":""/content/dam/trjo/products/m304/91180.png"",""metadata"":""{\""src\"":\""/content/dam/trjo/products/m304/91180.png/jcr:content/renditions/cq5dam.web.1280.1280\"",\""srcSet\"":[{\""src\"":\""/content/dam/trjo/products/m304/91180.png/jcr:content/renditions/webp-640.webp\"",\""media\"":\""(max-width: 847px)\"",\""type\"":\""image/webp\""},{\""src\"":\""/content/dam/trjo/products/m304/91180.png/jcr:content/renditions/webp-1280.webp\"",\""media\"":\""(min-width: 848px)\"",\""type\"":\""image/webp\""},{\""src\"":\""/content/dam/trjo/products/m304/91180.png/jcr:content/renditions/cq5dam.web.640.640\"",\""media\"":\""(max-width: 847px)\"",\""type\"":\""image/png\""},{\""src\"":\""/content/dam/trjo/products/m304/91180.png/jcr:content/renditions/cq5dam.web.1280.1280\"",\""media\"":\""(min-width: 848px)\"",\""type\"":\""image/png\""}],\""alt\"":\""Trader Joe's Gingerbread Coffee\"",\""srcOriginal\"":\""/content/dam/trjo/products/m304/91180.png\""}"",""__typename"":""ImageWithMeta""},""sales_size"":14,""sales_uom_description"":""Oz"",""price_range"":{""minimum_price"":{""final_price"":{""currency"":""USD"",""value"":8.99,""__typename"":""Money""},""__typename"":""ProductPrice""},""__typename"":""PriceRange""},""fun_tags"":[""Glass Half Full"",""Merry-making"",""Rise & Shine""],""item_characteristics"":[""Kosher""],""__typename"":""SimpleProduct"",""dietaryTags"":"""",""product_variants"":[]}"
"Decaf, Delish, Desired

Back in 2009, we introduced our Decaffeinated Candy Cane Green Tea to significantly stronger customer 
response than anticipated. In other words, we ran out. Really quickly. And you were sad. And so were we. 
And so, we brought in more, and we sold more. Four years later, it continues to be a highly anticipated 
Trader Joe's holiday product.

What's so special about this tea? It's just really good. Naturally decaffeinated green tea, spiked with 
peppermint - except for its lack of red and white stripes and impossible-to-remove wrapper, this tea is 
astonishingly evocative of an actual candy cane. Served hot or cold, it's soothing and satisfying.

Trader Joe's Decaffeinated Candy Cane Green Tea also makes a great gift. You can add it to a gift basket 
or pop it in a stocking. Buy some for yourself and give the adorable, polar-bear-adorned box to your kids 
- kids always like the box more than what comes inside, you know. Our price of $1.99 for a box of 20 tea 
bags is the same as it was in 2009, making this a great value, yet again.",93461,,20 Bag,,Candy Cane Green Tea,2.79,,,https://www.traderjoes.com/content/dam/trjo/products/m304/93461.png,,,,https://www.traderjoes.com/home/products/pdp/candy-cane-green-tea-093461,,,,,,,,"{""item_title"":""Candy Cane Green Tea"",""category_hierarchy"":[{""id"":2,""name"":""Products"",""__typename"":""CategoryTree""},{""id"":182,""name"":""Beverages"",""__typename"":""CategoryTree""},{""id"":194,""name"":""Coffee & Tea"",""__typename"":""CategoryTree""}],""primary_image"":""/content/dam/trjo/products/m304/93461.png"",""primary_image_meta"":{""url"":""/content/dam/trjo/products/m304/93461.png"",""metadata"":""{\""src\"":\""/content/dam/trjo/products/m304/93461.png/jcr:content/renditions/cq5dam.web.1280.1280\"",\""srcSet\"":[{\""src\"":\""/content/dam/trjo/products/m304/93461.png/jcr:content/renditions/webp-640.webp\"",\""media\"":\""(max-width: 847px)\"",\""type\"":\""image/webp\""},{\""src\"":\""/content/dam/trjo/products/m304/93461.png/jcr:content/renditions/webp-1280.webp\"",\""media\"":\""(min-width: 848px)\"",\""type\"":\""image/webp\""},{\""src\"":\""/content/dam/trjo/products/m304/93461.png/jcr:content/renditions/cq5dam.web.640.640\"",\""media\"":\""(max-width: 847px)\"",\""type\"":\""image/png\""},{\""src\"":\""/content/dam/trjo/products/m304/93461.png/jcr:content/renditions/cq5dam.web.1280.1280\"",\""media\"":\""(min-width: 848px)\"",\""type\"":\""image/png\""}],\""alt\"":\""Trader Joe's Candy Cane Decaffeinated Green Tea\"",\""srcOriginal\"":\""/content/dam/trjo/products/m304/93461.png\""}"",""__typename"":""ImageWithMeta""},""sales_size"":20,""sales_uom_description"":""Bag"",""price_range"":{""minimum_price"":{""final_price"":{""currency"":""USD"",""value"":2.79,""__typename"":""Money""},""__typename"":""ProductPrice""},""__typename"":""PriceRange""},""fun_tags"":[""Chance of Rain"",""Cold Front"",""Fall Faves"",""Giftable"",""Merry-making"",""Rain or Shine"",""Rise & Shine""],""item_characteristics"":[""Kosher""],""__typename"":""SimpleProduct"",""dietaryTags"":"""",""product_variants"":[]}"
"While it's generally accepted that the Mayans were the first to make a beverage out of chocolate, this drink 
bore little resemblance to what we now know as hot chocolate.  It was spicy and bitter and definitely an ac-
quired taste. Over time, adventurous aristocrats (chocolate was very  expensive) added spices to ty to make 
the drink more enjoyable. It's the seventeenth century Europeans, historically speaking, who get the credit for 
adding sugar to this bitter concoction, making it eminently more palatable and desirable.

With the introduction of Trader Joe's Salted Caramel Flavored Hot Cocoa, we'll humbly take the credit for 
making this classic beverage even more palatable and desirable. We've taken traditional hot cocoa mix - you 
know, one that's rich and creamy and sweet and incredibly delicious in every way - and added natural cara-
mel flavor, so that every sip delivers the enhanced richness and sweetness of caramel. But we didn't stop there. 
Nope. We went all the way in, adding salt to the caramel flavor, so that the final result, when mixed with hot 
water or milk, is the warm, liquid manifestation of our ever-popular Dark Chocolate Sea Salt Caramels [sku 
90845]. A single sip simply wouldn't suffice, so a single scoop makes a nice-sized mug of salty, caramely, 
chocolately deliciousness.

We're selling each 10 ounce canister of Trader Joe's Salted Caramel Flavored Hot Cocoa for $3.99, with 
about eight servings per canister, throughout the cold-weather months. You'll find it with our other hot cocoa 
offerings.

11.06.
17",61572,,10 Oz,,Salted Caramel Hot Cocoa,1.99,,,https://www.traderjoes.com/content/dam/trjo/products/m304/61572.png,,,,https://www.traderjoes.com/home/products/pdp/salted-caramel-hot-cocoa-061572,,,,,,,,"{""item_title"":""Salted Caramel Hot Cocoa"",""category_hierarchy"":[{""id"":2,""name"":""Products"",""__typename"":""CategoryTree""},{""id"":182,""name"":""Beverages"",""__typename"":""CategoryTree""},{""id"":194,""name"":""Coffee & Tea"",""__typename"":""CategoryTree""}],""primary_image"":""/content/dam/trjo/products/m304/61572.png"",""primary_image_meta"":{""url"":""/content/dam/trjo/products/m304/61572.png"",""metadata"":""{\""src\"":\""/content/dam/trjo/products/m304/61572.png/jcr:content/renditions/cq5dam.web.1280.1280\"",\""srcSet\"":[{\""src\"":\""/content/dam/trjo/products/m304/61572.png/jcr:content/renditions/webp-640.webp\"",\""media\"":\""(max-width: 847px)\"",\""type\"":\""image/webp\""},{\""src\"":\""/content/dam/trjo/products/m304/61572.png/jcr:content/renditions/webp-1280.webp\"",\""media\"":\""(min-width: 848px)\"",\""type\"":\""image/webp\""},{\""src\"":\""/content/dam/trjo/products/m304/61572.png/jcr:content/renditions/cq5dam.web.640.640\"",\""media\"":\""(max-width: 847px)\"",\""type\"":\""image/png\""},{\""src\"":\""/content/dam/trjo/products/m304/61572.png/jcr:content/renditions/cq5dam.web.1280.1280\"",\""media\"":\""(min-width: 848px)\"",\""type\"":\""image/png\""}],\""alt\"":\""Salted Caramel Hot Cocoa\"",\""srcOriginal\"":\""/content/dam/trjo/products/m304/61572.png\""}"",""__typename"":""ImageWithMeta""},""sales_size"":10,""sales_uom_description"":""Oz"",""price_range"":{""minimum_price"":{""final_price"":{""currency"":""USD"",""value"":1.99,""__typename"":""Money""},""__typename"":""ProductPrice""},""__typename"":""PriceRange""},""fun_tags"":[""Cold Front"",""Merry-making"",""Treat Yourself""],""item_characteristics"":[""Kosher""],""__typename"":""SimpleProduct"",""dietaryTags"":"""",""product_variants"":[]}"
"""Some people will tell you there is a great deal of poetry and ¿ ne sentiment in a chest of tea."" 
          -Ralph Waldo Emerson

With this wisdom from Emerson in mind, we set out to develop a ¿ awless fall tea bursting with ""poetry and 
¿ ne sentiment."" Tasseographists would say that this tea we developed foretells leaves falling, apple picking, wind 
whistling, and ¿ re crackling. You don't need to be adept at reading leaves to decipher that harvest memories are 
made in Trader Joe's Harvest Blend Herbal Tea. 

With aromatic bursts of cinnamon and ginger, an abundance of apple ¿ avor and a sweet-spicy lingering ¿ nish, 
Trader Joe's Harvest Blend Herbal Tea delivers a season's-worth of experiences in a sip. Don't let that stop you 
from seeking out those experiences yourself, though. In fact, we encourage it! Brew a cup and head out to the 
pumpkin patch or take a walk in the brisk fall weather. Naturally ca¿ eine free, it invigorates the senses with 
vibrant apple aromas and soothes both stomach and soul with rich, ginger-cinnamon warmth.

A must-have this autumn, you'll ¿ nd this on our shelves only for a limited time. Our Harvest Blend Tea is easy 
to fall for, especially at $1.99 for each foxy box of 20 tea bags.",51424,,20 Bag,,Harvest Blend Herbal Tea,2.49,,,https://www.traderjoes.com/content/dam/trjo/products/m304/51424.png,,,,https://www.traderjoes.com/home/products/pdp/harvest-blend-herbal-tea-051424,,,,,,,,"{""item_title"":""Harvest Blend Herbal Tea"",""category_hierarchy"":[{""id"":2,""name"":""Products"",""__typename"":""CategoryTree""},{""id"":182,""name"":""Beverages"",""__typename"":""CategoryTree""},{""id"":194,""name"":""Coffee & Tea"",""__typename"":""CategoryTree""}],""primary_image"":""/content/dam/trjo/products/m304/51424.png"",""primary_image_meta"":{""url"":""/content/dam/trjo/products/m304/51424.png"",""metadata"":""{\""src\"":\""/content/dam/trjo/products/m304/51424.png/jcr:content/renditions/cq5dam.web.1280.1280\"",\""srcSet\"":[{\""src\"":\""/content/dam/trjo/products/m304/51424.png/jcr:content/renditions/webp-640.webp\"",\""media\"":\""(max-width: 847px)\"",\""type\"":\""image/webp\""},{\""src\"":\""/content/dam/trjo/products/m304/51424.png/jcr:content/renditions/webp-1280.webp\"",\""media\"":\""(min-width: 848px)\"",\""type\"":\""image/webp\""},{\""src\"":\""/content/dam/trjo/products/m304/51424.png/jcr:content/renditions/cq5dam.web.640.640\"",\""media\"":\""(max-width: 847px)\"",\""type\"":\""image/png\""},{\""src\"":\""/content/dam/trjo/products/m304/51424.png/jcr:content/renditions/cq5dam.web.1280.1280\"",\""media\"":\""(min-width: 848px)\"",\""type\"":\""image/png\""}],\""alt\"":\""Trader Joe's Harvest Blend Herbal Tea\"",\""srcOriginal\"":\""/content/dam/trjo/products/m304/51424.png\""}"",""__typename"":""ImageWithMeta""},""sales_size"":20,""sales_uom_description"":""Bag"",""price_range"":{""minimum_price"":{""final_price"":{""currency"":""USD"",""value"":2.49,""__typename"":""Money""},""__typename"":""ProductPrice""},""__typename"":""PriceRange""},""fun_tags"":[""Alfresco Dining"",""Desk Drawer"",""Fall Faves"",""Glass Half Full"",""Rain or Shine"",""Rise & Shine"",""Welcoming""],""item_characteristics"":[""Kosher""],""__typename"":""SimpleProduct"",""dietaryTags"":"""",""product_variants"":[]}"
"All of our limited-edition, whole-bean Small Lot Coffees are special in some way, and Trader Joe's Arroyo 
Bonito Estate Dominican Republic Coffee is no exception. As its name would suggest, the beans come to us 
from the Arroyo Bonito Estate, located at about 4,500 feet above sea level in the D.R.'s mountainous, central 
region. There, the coffee plants thrive in the fertile mountain soil, under a canopy of pine, macadamia, and 
guava trees. 

The farm is owned and operated by a family with over 30 years of coffee cultivation experience who-following 
their own unique, natural, wine-like process-allow the beans to over-ripen just a bit before harvest, resulting 
in a higher sugar concentration. The sweet, coffee cherries are dried in the sun for 21 days, then milled very 
slowly to thoroughly crack the outer husks. Finally, they're set aside to ""rest"" an additional 30 days before being 
sent stateside to be roasted. The whole process yields a well-balanced cup of 100% Arabica, medium-roast 
coffee with a nice ""wine-y"" taste and notes of dried cherry, raisin, and plum. 

We're selling Trader Joe's Arroyo Bonito Estate Small Lot Coffee in 12-ounce bags for $9.99 each. Grab some 
now, before this one disappears and makes way for the next Small Lot in the lineup!

Arroyo Bonito Estate Dominican Republic
Small Lot Coffee",72539,,12 Oz,,Arroyo Bonito Estate Dominican Republic Small Lot Coffee,9.99,,,https://www.traderjoes.com/content/dam/trjo/products/m304/72539.png,,,,https://www.traderjoes.com/home/products/pdp/arroyo-bonito-estate-dominican-republic-small-lot-coffee-072539,,,,,,,,"{""item_title"":""Arroyo Bonito Estate Dominican Republic Small Lot Coffee"",""category_hierarchy"":[{""id"":2,""name"":""Products"",""__typename"":""CategoryTree""},{""id"":182,""name"":""Beverages"",""__typename"":""CategoryTree""},{""id"":194,""name"":""Coffee & Tea"",""__typename"":""CategoryTree""}],""primary_image"":""/content/dam/trjo/products/m304/72539.png"",""primary_image_meta"":{""url"":""/content/dam/trjo/products/m304/72539.png"",""metadata"":""{\""src\"":\""/content/dam/trjo/products/m304/72539.png/jcr:content/renditions/cq5dam.web.1280.1280\"",\""srcSet\"":[{\""src\"":\""/content/dam/trjo/products/m304/72539.png/jcr:content/renditions/webp-640.webp\"",\""media\"":\""(max-width: 847px)\"",\""type\"":\""image/webp\""},{\""src\"":\""/content/dam/trjo/products/m304/72539.png/jcr:content/renditions/webp-1280.webp\"",\""media\"":\""(min-width: 848px)\"",\""type\"":\""image/webp\""},{\""src\"":\""/content/dam/trjo/products/m304/72539.png/jcr:content/renditions/cq5dam.web.640.640\"",\""media\"":\""(max-width: 847px)\"",\""type\"":\""image/png\""},{\""src\"":\""/content/dam/trjo/products/m304/72539.png/jcr:content/renditions/cq5dam.web.1280.1280\"",\""media\"":\""(min-width: 848px)\"",\""type\"":\""image/png\""}],\""alt\"":\""Trader Joe's Arroyo Bonito Estate Dominican Republic Small Lot Coffee\"",\""srcOriginal\"":\""/content/dam/trjo/products/m304/72539.png\""}"",""__typename"":""ImageWithMeta""},""sales_size"":12,""sales_uom_description"":""Oz"",""price_range"":{""minimum_price"":{""final_price"":{""currency"":""USD"",""value"":9.99,""__typename"":""Money""},""__typename"":""ProductPrice""},""__typename"":""PriceRange""},""fun_tags"":[""Brunch All Day"",""Rise & Shine""],""item_characteristics"":[""Kosher""],""__typename"":""SimpleProduct"",""dietaryTags"":"""",""product_variants"":[]}"
