description,sku,pack,size,gtin,name,retail_price,is_catch_weight,average_case_weight,image,manufacturer_sku,ordering_unit,is_broken_case,content_url,brand,level_1,level_2,level_3,manufacturer_name,distributor_name,unit_price,extra_data
"Just as it says on the jar, our certified spice sensation Everything But The Elote Seasoning Blend [sku 66804] 
offers all the flavors of a classic, freshly grilled elote, just without the corn that normally carries them. So when 
the time came to infuse those flavors into a tangy yogurt dip, we got to thinking: why not have our corn and 
season it, too? Boldly flavored with garlic, Parmesan, and chipotle pepper powder, and featuring toothsome 
kernels of sweet yellow corn, Trader Joe's Everything And The Elote Greek Style Yogurt Dip truly lets you 
have it all.

As it turns out, creamy, lightly tart yogurt and zesty, lightly smoky elote make for a pretty perfect flavor and 
texture combination - and one that serves equally well with pretty much any kind of scooping vehicle, be it 
a tortilla chip, cracker, or baby carrot. We also feel obligated to mention how well Everything And The Elote 
Dip works as a spread, especially on sandwiches and wraps that already have a spicy element. And if you really 
want to take things to an elote extreme, you can always attempt a grilled cheese spread with a layer this Dip, 
plus a handful of crushed Organic Elote Corn Chip Dippers [sku 60564]...

 *Please check QIL to confirm current pricing.

Everything And The Elote
Greek Style Yogurt Dip",70506,,,,Everything And the Elote Greek Style Yogurt Dip,3.79,,,https://www.traderjoes.com/content/dam/trjo/products/m20404/70506.png,,,,https://www.traderjoes.com/home/products/pdp/everything-and-the-elote-greek-style-yogurt-dip-070506,,,,,,,,"{""item_title"":""Everything And the Elote Greek Style Yogurt Dip"",""category_hierarchy"":[{""id"":2,""name"":""Products"",""__typename"":""CategoryTree""},{""id"":8,""name"":""Food"",""__typename"":""CategoryTree""},{""id"":59,""name"":""Dips, Sauces & Dressings"",""__typename"":""CategoryTree""},{""id"":71,""name"":""Dip/Spread"",""__typename"":""CategoryTree""}],""primary_image"":""/content/dam/trjo/products/m20404/70506.png"",""primary_image_meta"":{""url"":""/content/dam/trjo/products/m20404/70506.png"",""metadata"":""{\""src\"":\""/content/dam/trjo/products/m20404/70506.png/jcr:content/renditions/cq5dam.web.1280.1280\"",\""srcSet\"":[{\""src\"":\""/content/dam/trjo/products/m20404/70506.png/jcr:content/renditions/webp-640.webp\"",\""media\"":\""(max-width: 847px)\"",\""type\"":\""image/webp\""},{\""src\"":\""/content/dam/trjo/products/m20404/70506.png/jcr:content/renditions/webp-1280.webp\"",\""media\"":\""(min-width: 848px)\"",\""type\"":\""image/webp\""},{\""src\"":\""/content/dam/trjo/products/m20404/70506.png/jcr:content/renditions/cq5dam.web.640.640\"",\""media\"":\""(max-width: 847px)\"",\""type\"":\""image/png\""},{\""src\"":\""/content/dam/trjo/products/m20404/70506.png/jcr:content/renditions/cq5dam.web.1280.1280\"",\""media\"":\""(min-width: 848px)\"",\""type\"":\""image/png\""}],\""alt\"":\""Everything and the Elote Greek Style Yogurt Dip\"",\""srcOriginal\"":\""/content/dam/trjo/products/m20404/70506.png\""}"",""__typename"":""ImageWithMeta""},""sales_size"":8,""sales_uom_description"":""Oz"",""price_range"":{""minimum_price"":{""final_price"":{""currency"":""USD"",""value"":3.79,""__typename"":""Money""},""__typename"":""ProductPrice""},""__typename"":""PriceRange""},""fun_tags"":[""Pour It On"",""The \""X\"" Factor"",""Yes!""],""item_characteristics"":[""Kosher""],""__typename"":""SimpleProduct"",""dietaryTags"":"""",""product_variants"":[]}"
"It's not every day that you encounter a salad dressing that's simulataneously sweet, spicy, creamy, and vegan - 
unless you happen to visit your neighborhood Trader Joe's every day, that is. Because that's precisely what you'll 
encounter in Trader Joe's Spicy Cashew Butter Dressing, a salad dressing that combines smooth, creamy 
cashew butter with lime juice, ginger, cilantro, and hot chili peppers into one remarkably versatile condiment. 
And have we mentioned that it's totally vegan?

With its almost luxuriously creamy texture and zesty, herby, charmingly aromatic notes, Trader Joe's Spicy 
Cashew Butter Dressing adds flavorful flair to any leafy green salad, but that's hardly where we'd stop. Cold 
noodles, grilled fish, pan-fried poultry, savory dishes of all kinds can be improved with a drizzling of this 
Dressing. We find its snappy, savory profile makes it especially suited for topping plant-based burgers or vegan 
jackfruit tacos. You'll find its retail makes it an especially great value: we're selling 11-fl. oz. bottles of Trader 
Joe's Spicy Cashew Butter Dressing for $3.99*, every day. Look for them in our refrigerated section, next to 
our other fresh salad dressings.

 *Please check QIL to confirm current pricing.

Spicy Cashew Butter Dressing",68423,,,,Spicy Cashew Butter Dressing,3.99,,,https://www.traderjoes.com/content/dam/trjo/products/m20405/68423.png,,,,https://www.traderjoes.com/home/products/pdp/spicy-cashew-butter-dressing-068423,,,,,,,,"{""item_title"":""Spicy Cashew Butter Dressing"",""category_hierarchy"":[{""id"":2,""name"":""Products"",""__typename"":""CategoryTree""},{""id"":8,""name"":""Food"",""__typename"":""CategoryTree""},{""id"":59,""name"":""Dips, Sauces & Dressings"",""__typename"":""CategoryTree""},{""id"":74,""name"":""Dressing & Seasoning"",""__typename"":""CategoryTree""}],""primary_image"":""/content/dam/trjo/products/m20405/68423.png"",""primary_image_meta"":{""url"":""/content/dam/trjo/products/m20405/68423.png"",""metadata"":""{\""src\"":\""/content/dam/trjo/products/m20405/68423.png/jcr:content/renditions/cq5dam.web.1280.1280\"",\""srcSet\"":[{\""src\"":\""/content/dam/trjo/products/m20405/68423.png/jcr:content/renditions/webp-640.webp\"",\""media\"":\""(max-width: 847px)\"",\""type\"":\""image/webp\""},{\""src\"":\""/content/dam/trjo/products/m20405/68423.png/jcr:content/renditions/webp-1280.webp\"",\""media\"":\""(min-width: 848px)\"",\""type\"":\""image/webp\""},{\""src\"":\""/content/dam/trjo/products/m20405/68423.png/jcr:content/renditions/cq5dam.web.640.640\"",\""media\"":\""(max-width: 847px)\"",\""type\"":\""image/png\""},{\""src\"":\""/content/dam/trjo/products/m20405/68423.png/jcr:content/renditions/cq5dam.web.1280.1280\"",\""media\"":\""(min-width: 848px)\"",\""type\"":\""image/png\""}],\""alt\"":\""Spicy Cashew Butter Dressing\"",\""srcOriginal\"":\""/content/dam/trjo/products/m20405/68423.png\""}"",""__typename"":""ImageWithMeta""},""sales_size"":11,""sales_uom_description"":""Oz"",""price_range"":{""minimum_price"":{""final_price"":{""currency"":""USD"",""value"":3.99,""__typename"":""Money""},""__typename"":""ProductPrice""},""__typename"":""PriceRange""},""fun_tags"":[""Alfresco Dining""],""item_characteristics"":[""Vegan""],""__typename"":""SimpleProduct"",""dietaryTags"":"""",""product_variants"":[]}"
"When it comes to something as simply delicious and purely flavorful as salsa, there's no need to overcomplicate 
things. That's why, with Trader Joe's Salsa Autentica, we opted for a simple recipe using just six ingredients: 
tomato puree, yellow chili peppers, salt, vinegar, dried onion, and garlic powder. Combined, these ingredients 
create an impeccably textured Salsa with plenty of savory spices and tempered heat - a Salsa that pays homage 
to its culinary tradition and goes well on just about anything - a Salsa that's, simply put, simply Autentica. 

Our Salsa Autentica's zesty flavor profile not only makes it a natural companion for dipping with your favorite 
tortilla chip, but it also makes a great condiment to pour over nachos, to spoon into burritos, or to apply 
generously on savory breakfast items.  Don't just take our word for it, its simple, universal appeal has clearly 
stood the test of time: for close to three decades, and it's set the standard for other salsas on our shelves. 

You can find 12-ounce jars of Trader Joe's Salsa Autentica for $1.99*, every day. Look for them with our other 
jarred salsas.

 *Please check QIL to confirm current pricing.

Salsa Autentica",1535,,,,Salsa Autentica,2.29,,,https://www.traderjoes.com/content/dam/trjo/products/m20403/01535.png,,,,https://www.traderjoes.com/home/products/pdp/salsa-autentica-001535,,,,,,,,"{""item_title"":""Salsa Autentica"",""category_hierarchy"":[{""id"":2,""name"":""Products"",""__typename"":""CategoryTree""},{""id"":8,""name"":""Food"",""__typename"":""CategoryTree""},{""id"":59,""name"":""Dips, Sauces & Dressings"",""__typename"":""CategoryTree""},{""id"":68,""name"":""Salsa & Hot Sauce"",""__typename"":""CategoryTree""}],""primary_image"":""/content/dam/trjo/products/m20403/01535.png"",""primary_image_meta"":{""url"":""/content/dam/trjo/products/m20403/01535.png"",""metadata"":""{\""src\"":\""/content/dam/trjo/products/m20403/01535.png/jcr:content/renditions/cq5dam.web.1280.1280\"",\""srcSet\"":[{\""src\"":\""/content/dam/trjo/products/m20403/01535.png/jcr:content/renditions/webp-640.webp\"",\""media\"":\""(max-width: 847px)\"",\""type\"":\""image/webp\""},{\""src\"":\""/content/dam/trjo/products/m20403/01535.png/jcr:content/renditions/webp-1280.webp\"",\""media\"":\""(min-width: 848px)\"",\""type\"":\""image/webp\""},{\""src\"":\""/content/dam/trjo/products/m20403/01535.png/jcr:content/renditions/cq5dam.web.640.640\"",\""media\"":\""(max-width: 847px)\"",\""type\"":\""image/png\""},{\""src\"":\""/content/dam/trjo/products/m20403/01535.png/jcr:content/renditions/cq5dam.web.1280.1280\"",\""media\"":\""(min-width: 848px)\"",\""type\"":\""image/png\""}],\""alt\"":\""Salsa Autentica\"",\""srcOriginal\"":\""/content/dam/trjo/products/m20403/01535.png\""}"",""__typename"":""ImageWithMeta""},""sales_size"":12,""sales_uom_description"":""Oz"",""price_range"":{""minimum_price"":{""final_price"":{""currency"":""USD"",""value"":2.29,""__typename"":""Money""},""__typename"":""ProductPrice""},""__typename"":""PriceRange""},""fun_tags"":[""Midday Snacks""],""item_characteristics"":null,""__typename"":""SimpleProduct"",""dietaryTags"":"""",""product_variants"":[]}"
"One of our most successful approaches to developing new products is to simply combine two distinct items 
that are already well loved. Think Cocoa Almond Spread (chocolate + almonds), or Reduced Guilt Chunky 
Guacamole (Greek yogurt + guacamole), or Thai Chili Lime Cashews (Thai lime & chili seasoning + cashews). 
Don't forget one of our all-time favorites: Pumpkin ""fill-in-the-blank"" (Pumpkin + anything). 

Organic Sriracha & Roasted Garlic BBQ Sauce is our latest foray into the art of food fusion. As far as we 
can tell, it appears destined for condiment greatness. The formula is simple: Sriracha + BBQ Sauce¿ but, the 
genius is in the details. We start with Sriracha (not the famous ""Rooster"" version, but our very own recipe). 
This spicy mixture of chili peppers, garlic, sugar, and vinegar is deftly combined with what some might label as 
""Memphis-style"" BBQ Sauce-referring to its tomato-base, thick texture, reddish-brown color, and the taste of 
sweet molasses. As if this duo were not already dynamic enough, we decided to go all out Organic. Each and 
every ingredient in our Sriracha & Roasted Garlic BBQ Sauce was produced using methods that preserve the 
environment and avoid synthetic materials, such as pesticides and antibiotics.

This marvelous marriage tastes of Sriracha and... BBQ Sauce. It is garlicky, sweet, and spicy-all at once. The 
flavors here enhance burgers, meat kabobs, beef or pork ribs, even grilled seafood. These might seem like rather 
expected applications for a sauce such as this, but the innovation doesn't need to stop with Trader Joe's. First, 
procure your own 19.5-ounce, screw-cap bottle for $2.99. Open it up. Love it. Then, proceed to combine with 
whatever foods your heart might fancy. If you hit on something big, let us know!

11.17.
14",53799,,,,Organic Sriracha & Roasted Garlic BBQ Sauce,3.49,,,https://www.traderjoes.com/content/dam/trjo/products/m20402/53799.png,,,,https://www.traderjoes.com/home/products/pdp/organic-sriracha-&-roasted-garlic-bbq-sauce-053799,,,,,,,,"{""item_title"":""Organic Sriracha & Roasted Garlic BBQ Sauce"",""category_hierarchy"":[{""id"":2,""name"":""Products"",""__typename"":""CategoryTree""},{""id"":8,""name"":""Food"",""__typename"":""CategoryTree""},{""id"":59,""name"":""Dips, Sauces & Dressings"",""__typename"":""CategoryTree""},{""id"":65,""name"":""BBQ, Pasta, Simmer"",""__typename"":""CategoryTree""}],""primary_image"":""/content/dam/trjo/products/m20402/53799.png"",""primary_image_meta"":{""url"":""/content/dam/trjo/products/m20402/53799.png"",""metadata"":""{\""src\"":\""/content/dam/trjo/products/m20402/53799.png/jcr:content/renditions/cq5dam.web.1280.1280\"",\""srcSet\"":[{\""src\"":\""/content/dam/trjo/products/m20402/53799.png/jcr:content/renditions/webp-640.webp\"",\""media\"":\""(max-width: 847px)\"",\""type\"":\""image/webp\""},{\""src\"":\""/content/dam/trjo/products/m20402/53799.png/jcr:content/renditions/webp-1280.webp\"",\""media\"":\""(min-width: 848px)\"",\""type\"":\""image/webp\""},{\""src\"":\""/content/dam/trjo/products/m20402/53799.png/jcr:content/renditions/cq5dam.web.640.640\"",\""media\"":\""(max-width: 847px)\"",\""type\"":\""image/png\""},{\""src\"":\""/content/dam/trjo/products/m20402/53799.png/jcr:content/renditions/cq5dam.web.1280.1280\"",\""media\"":\""(min-width: 848px)\"",\""type\"":\""image/png\""}],\""alt\"":\""Organic Sriracha Roasted Garlic BBQ Sauce\"",\""srcOriginal\"":\""/content/dam/trjo/products/m20402/53799.png\""}"",""__typename"":""ImageWithMeta""},""sales_size"":19.5,""sales_uom_description"":""Oz"",""price_range"":{""minimum_price"":{""final_price"":{""currency"":""USD"",""value"":3.49,""__typename"":""Money""},""__typename"":""ProductPrice""},""__typename"":""PriceRange""},""fun_tags"":[""Alfresco Dining"",""Mouth On Fire"",""Pour It On""],""item_characteristics"":[""Organic""],""__typename"":""SimpleProduct"",""dietaryTags"":"""",""product_variants"":[]}"
"Some BBQ sauces are sweet. Some BBQ sauces are spicy. Some are a little bit of both. Trader Joe's Organic 
Sweet & Spicy Pineapple BBQ Sauce is a lot of both. It's made with real crushed pineapple, pineapple juice 
concentrate, and a blend of savory spices including habanero pepper powder - all of which are organic, by the 
way. This saucy synthesis of sweet tropical heat makes for an amazing glaze for ribs or chicken (try it on a batch 
of Organic Chicken Drumsticks [SKU 99264], for starters), a tip-top topping for burgers (especially with an 
added slice of grilled pineapple), and a sublime substitute for tomato sauce when making spicy BBQ pizza. In 
short, it's everything we like about grilling, sweetness, spice, and summer, poured into one bottle.

That said, this summer-y treat won't be around forever. We're bringing in a limited number of cases of this 
Sauce; just enough to last us through the rest of the season. So, while supplies last, make sure to grab a 19.5 
ounce bottle of Trader Joe's Organic Sweet & Spicy Pineapple BBQ Sauce for the suitably sweet (and aptly 
hot) price of $2.99*. You'll find them in our grocery aisle.

 *Please check QIL to confirm current pricing.

Organic Sweet & Spicy
Pineapple BBQ Sauce",69553,,,,Organic Sweet & Spicy Pineapple  BBQ Sauce,2.99,,,https://www.traderjoes.com/content/dam/trjo/products/m20402/69553.png,,,,https://www.traderjoes.com/home/products/pdp/organic-sweet-&-spicy-pineapple-bbq-sauce-069553,,,,,,,,"{""item_title"":""Organic Sweet & Spicy Pineapple  BBQ Sauce"",""category_hierarchy"":[{""id"":2,""name"":""Products"",""__typename"":""CategoryTree""},{""id"":8,""name"":""Food"",""__typename"":""CategoryTree""},{""id"":59,""name"":""Dips, Sauces & Dressings"",""__typename"":""CategoryTree""},{""id"":62,""name"":""Condiments"",""__typename"":""CategoryTree""}],""primary_image"":""/content/dam/trjo/products/m20402/69553.png"",""primary_image_meta"":{""url"":""/content/dam/trjo/products/m20402/69553.png"",""metadata"":""{\""src\"":\""/content/dam/trjo/products/m20402/69553.png/jcr:content/renditions/cq5dam.web.1280.1280\"",\""srcSet\"":[],\""srcOriginal\"":\""/content/dam/trjo/products/m20402/69553.png\""}"",""__typename"":""ImageWithMeta""},""sales_size"":19.5,""sales_uom_description"":""Oz"",""price_range"":{""minimum_price"":{""final_price"":{""currency"":""USD"",""value"":2.99,""__typename"":""Money""},""__typename"":""ProductPrice""},""__typename"":""PriceRange""},""fun_tags"":[""Fire Up The Grill"",""Mouth On Fire"",""Picnic""],""item_characteristics"":[""Organic""],""__typename"":""SimpleProduct"",""dietaryTags"":"""",""product_variants"":[]}"
"Like the classic brunch beverage that inspired it, Trader Joe's Bloody Mary Salsa starts with a base of tangy 
tomatoes, buoyed by a nose-tingling horseradish. Jalapeños and green chili peppers add heat; Worcestershire 
sauce, capers, and onions add some savory balance; and lemon juice and vinegar kick up the acid ante. It's got 
that authentic, tangy & tongue-tingling Bloody Mary taste (sans vodka), with just enough heat to keep you 
sipping - or in this case, dipping - for more.

While Bloody Mary Salsa makes a bang-up dip for nearly all things crunchy (we love it with our Salted Tortilla 
Chips [sku 38985], or celery sticks, a la an actual Bloody Mary), it can be equally enjoyed anywhere & anytime 
you need a bracing hit of flavor, no matter the meal. Try rolling some up in a bean & cheese burrito, spooning 
some atop Carne Asada Autentica [skus 81909/75977] & eggs, or adding a few dollops to a taco salad. No 
longer must you wait for the weekend to get your Bloody Mary flavor fix - simply pick up a jar of limited-
edition Trader Joe's Bloody Mary Salsa from our salsa shelves, while inventory lasts¿ 

 *Please check QIL to confirm current pricing.

Bloody Mary Salsa",70380,,,,Bloody Mary Salsa,2.69,,,https://www.traderjoes.com/content/dam/trjo/products/m20403/70380.png,,,,https://www.traderjoes.com/home/products/pdp/bloody-mary-salsa-070380,,,,,,,,"{""item_title"":""Bloody Mary Salsa"",""category_hierarchy"":[{""id"":2,""name"":""Products"",""__typename"":""CategoryTree""},{""id"":8,""name"":""Food"",""__typename"":""CategoryTree""},{""id"":59,""name"":""Dips, Sauces & Dressings"",""__typename"":""CategoryTree""},{""id"":68,""name"":""Salsa & Hot Sauce"",""__typename"":""CategoryTree""}],""primary_image"":""/content/dam/trjo/products/m20403/70380.png"",""primary_image_meta"":{""url"":""/content/dam/trjo/products/m20403/70380.png"",""metadata"":""{\""src\"":\""/content/dam/trjo/products/m20403/70380.png/jcr:content/renditions/cq5dam.web.1280.1280\"",\""srcSet\"":[{\""src\"":\""/content/dam/trjo/products/m20403/70380.png/jcr:content/renditions/webp-640.webp\"",\""media\"":\""(max-width: 847px)\"",\""type\"":\""image/webp\""},{\""src\"":\""/content/dam/trjo/products/m20403/70380.png/jcr:content/renditions/webp-1280.webp\"",\""media\"":\""(min-width: 848px)\"",\""type\"":\""image/webp\""},{\""src\"":\""/content/dam/trjo/products/m20403/70380.png/jcr:content/renditions/cq5dam.web.640.640\"",\""media\"":\""(max-width: 847px)\"",\""type\"":\""image/png\""},{\""src\"":\""/content/dam/trjo/products/m20403/70380.png/jcr:content/renditions/cq5dam.web.1280.1280\"",\""media\"":\""(min-width: 848px)\"",\""type\"":\""image/png\""}],\""alt\"":\""Bloody Mary Salsa\"",\""srcOriginal\"":\""/content/dam/trjo/products/m20403/70380.png\""}"",""__typename"":""ImageWithMeta""},""sales_size"":16,""sales_uom_description"":""Oz"",""price_range"":{""minimum_price"":{""final_price"":{""currency"":""USD"",""value"":2.69,""__typename"":""Money""},""__typename"":""ProductPrice""},""__typename"":""PriceRange""},""fun_tags"":[""Midday Snacks"",""Picnic""],""item_characteristics"":[""Kosher""],""__typename"":""SimpleProduct"",""dietaryTags"":"""",""product_variants"":[]}"
"Part of the joy of a pickle is that crisp crunch when you bite into it. But the taste that comes after the crunch is 
what really distinguishes a good pickle. You get the flavors of tangy vinegar, sea salt, and savory spices. With 
Trader Joe's Dill Pickle Hummus, we've taken that pickle flavor and literally put it into creamy, dip-able, 
spreadable hummus!

Our supplier starts with chickpeas (aka garbanzo beans) and cooks them down right along with whole dill 
pickles. The pickle-y chickpeas are then combined with tahini (ground sesame seeds), extra virgin olive oil, 
sea salt, and seasonings-which include dried onion & garlic, black pepper, and dill weed. The finished Dill 
Pickle Hummus may look like typical hummus on the outside, but every scoop delivers the terrific taste of 
pickles-albeit minus the crunch!

Grab an eight-ounce tub or two from our refrigerators while supplies last. We're only selling this limited Pickle 
Hummus over the summertime.

 *Please check QIL to confirm current pricing.

Dill Pickle Hummus",66803,,,,Dill Pickle Hummus,1.99,,,https://www.traderjoes.com/content/dam/trjo/products/m20404/66803.png,,,,https://www.traderjoes.com/home/products/pdp/dill-pickle-hummus-066803,,,,,,,,"{""item_title"":""Dill Pickle Hummus"",""category_hierarchy"":[{""id"":2,""name"":""Products"",""__typename"":""CategoryTree""},{""id"":8,""name"":""Food"",""__typename"":""CategoryTree""},{""id"":59,""name"":""Dips, Sauces & Dressings"",""__typename"":""CategoryTree""},{""id"":71,""name"":""Dip/Spread"",""__typename"":""CategoryTree""}],""primary_image"":""/content/dam/trjo/products/m20404/66803.png"",""primary_image_meta"":{""url"":""/content/dam/trjo/products/m20404/66803.png"",""metadata"":""{\""src\"":\""/content/dam/trjo/products/m20404/66803.png/jcr:content/renditions/cq5dam.web.1280.1280\"",\""srcSet\"":[{\""src\"":\""/content/dam/trjo/products/m20404/66803.png/jcr:content/renditions/webp-640.webp\"",\""media\"":\""(max-width: 847px)\"",\""type\"":\""image/webp\""},{\""src\"":\""/content/dam/trjo/products/m20404/66803.png/jcr:content/renditions/webp-1280.webp\"",\""media\"":\""(min-width: 848px)\"",\""type\"":\""image/webp\""},{\""src\"":\""/content/dam/trjo/products/m20404/66803.png/jcr:content/renditions/cq5dam.web.640.640\"",\""media\"":\""(max-width: 847px)\"",\""type\"":\""image/png\""},{\""src\"":\""/content/dam/trjo/products/m20404/66803.png/jcr:content/renditions/cq5dam.web.1280.1280\"",\""media\"":\""(min-width: 848px)\"",\""type\"":\""image/png\""}],\""alt\"":\""Dill Pickle Hummus\"",\""srcOriginal\"":\""/content/dam/trjo/products/m20404/66803.png\""}"",""__typename"":""ImageWithMeta""},""sales_size"":8,""sales_uom_description"":""Oz"",""price_range"":{""minimum_price"":{""final_price"":{""currency"":""USD"",""value"":1.99,""__typename"":""Money""},""__typename"":""ProductPrice""},""__typename"":""PriceRange""},""fun_tags"":[""Unexpected"",""Picnic""],""item_characteristics"":[""Kosher""],""__typename"":""SimpleProduct"",""dietaryTags"":"""",""product_variants"":[]}"
