description,sku,pack,size,gtin,name,retail_price,is_catch_weight,average_case_weight,image,manufacturer_sku,ordering_unit,is_broken_case,content_url,brand,level_1,level_2,level_3,manufacturer_name,distributor_name,unit_price,extra_data
"Are you fixing to find just the right fixin' for your hot dog? In a pickle over picking the optimal topping for a 
burger? Are your everyday dressings simply not cutting the mustard? Well, worry no more - we've concocted 
the consummate condiment for your needs. Trader Joe's Dill Pickle Mustard couples the savory versatility of 
mustard with the snappy, herbaceous kick of a well-dilled pickle via the addition of natural pickle flavoring, 
dill weed, and actual diced-up pickle pieces. Together, these elements form a superbly summer-y sauce that's 
even tastier than the sum of its parts.

Made for us by a fifth-generation mustard maker, our new Dill Pickle Mustard is an obvious must-have for 
burgers, hot dogs, and sandwiches - it's a natural for beach outings, backyard barbecues, and picnics in the 
park. We ought to also mention its usefulness in making marinades, deviled eggs, and especially delicious 
potato salad - give it a go with your favorite potatoes and you'll see exactly what we mean. For a limited time, 
you'll find Trader Joe's Dill Pickle Mustard on our condiment shelves.

 *Please check QIL to confirm current pricing.

Dill Pickle Mustard",71345,,,,Dill Pickle Mustard,1.99,,,https://www.traderjoes.com/content/dam/trjo/products/m20401/71345.png,,,,https://www.traderjoes.com/home/products/pdp/dill-pickle-mustard-071345,,,,,,,,"{""item_title"":""Dill Pickle Mustard"",""category_hierarchy"":[{""id"":2,""name"":""Products"",""__typename"":""CategoryTree""},{""id"":8,""name"":""Food"",""__typename"":""CategoryTree""},{""id"":59,""name"":""Dips, Sauces & Dressings"",""__typename"":""CategoryTree""},{""id"":62,""name"":""Condiments"",""__typename"":""CategoryTree""}],""primary_image"":""/content/dam/trjo/products/m20401/71345.png"",""primary_image_meta"":{""url"":""/content/dam/trjo/products/m20401/71345.png"",""metadata"":""{\""src\"":\""/content/dam/trjo/products/m20401/71345.png/jcr:content/renditions/cq5dam.web.1280.1280\"",\""srcSet\"":[{\""src\"":\""/content/dam/trjo/products/m20401/71345.png/jcr:content/renditions/webp-640.webp\"",\""media\"":\""(max-width: 847px)\"",\""type\"":\""image/webp\""},{\""src\"":\""/content/dam/trjo/products/m20401/71345.png/jcr:content/renditions/webp-1280.webp\"",\""media\"":\""(min-width: 848px)\"",\""type\"":\""image/webp\""},{\""src\"":\""/content/dam/trjo/products/m20401/71345.png/jcr:content/renditions/cq5dam.web.640.640\"",\""media\"":\""(max-width: 847px)\"",\""type\"":\""image/png\""},{\""src\"":\""/content/dam/trjo/products/m20401/71345.png/jcr:content/renditions/cq5dam.web.1280.1280\"",\""media\"":\""(min-width: 848px)\"",\""type\"":\""image/png\""}],\""alt\"":\""Dill Pickle Mustard\"",\""srcOriginal\"":\""/content/dam/trjo/products/m20401/71345.png\""}"",""__typename"":""ImageWithMeta""},""sales_size"":9,""sales_uom_description"":""Oz"",""price_range"":{""minimum_price"":{""final_price"":{""currency"":""USD"",""value"":1.99,""__typename"":""Money""},""__typename"":""ProductPrice""},""__typename"":""PriceRange""},""fun_tags"":[""Cut The Mustard"",""Picnic"",""Unexpected""],""item_characteristics"":[""Kosher""],""__typename"":""SimpleProduct"",""dietaryTags"":"""",""product_variants"":[]}"
"Looking to add a pop of excitement to your next salad or cole slaw? Then look no further than Trader Joe's 
Organic Poppy Seed Dressing! Combining the satisfying silkiness of a creamy vinaigrette with the classic 
crunch and uniquely nutty flavor of whole, Organic Poppy Seeds, this sweet, tangy, spring-seasonal Dressing 
is practically tailor-made for tossing with leafy greens or crisp cabbage - especially if there's some fresh-cut 
fruit in the picture, too.

Only available for a limited time, our Organic Poppy Seed Dressing pairs particularly well with lush leaves of  
Organic Baby Spinach [sku 32603], pilllowy Organic Butter Lettuce & Radicchio [sku 55052] or freshly chopped 
Organic Romaine Hearts [sku 37786]. Its mix of sweet, garlicky-savory, and lightly acidic notes (courtesy of 
organic white vinegar and organic apple cider vinegar), along with the textural pop provided by the Poppy 
Seeds, all synergize spectacularly with sliced strawberries, raisins, and stone fruit. And if you find yourself in 
need of a quick, delicious cole slaw once grilling season starts up, simply toss this Dressing with a bowlful of 
our Organic Shredded Green & Red Cabbage with Orange Carrots [sku 55824], and you're good to go.

 *Please check QIL to confirm current pricing.

Organic Poppy Seed Dressing",73994,,,,Organic Poppy Seed Dressing,3.69,,,https://www.traderjoes.com/content/dam/trjo/products/m20405/73994.png,,,,https://www.traderjoes.com/home/products/pdp/organic-poppy-seed-dressing-073994,,,,,,,,"{""item_title"":""Organic Poppy Seed Dressing"",""category_hierarchy"":[{""id"":2,""name"":""Products"",""__typename"":""CategoryTree""},{""id"":8,""name"":""Food"",""__typename"":""CategoryTree""},{""id"":59,""name"":""Dips, Sauces & Dressings"",""__typename"":""CategoryTree""},{""id"":74,""name"":""Dressing & Seasoning"",""__typename"":""CategoryTree""}],""primary_image"":""/content/dam/trjo/products/m20405/73994.png"",""primary_image_meta"":{""url"":""/content/dam/trjo/products/m20405/73994.png"",""metadata"":""{\""src\"":\""/content/dam/trjo/products/m20405/73994.png/jcr:content/renditions/cq5dam.web.1280.1280\"",\""srcSet\"":[{\""src\"":\""/content/dam/trjo/products/m20405/73994.png/jcr:content/renditions/webp-640.webp\"",\""media\"":\""(max-width: 847px)\"",\""type\"":\""image/webp\""},{\""src\"":\""/content/dam/trjo/products/m20405/73994.png/jcr:content/renditions/webp-1280.webp\"",\""media\"":\""(min-width: 848px)\"",\""type\"":\""image/webp\""},{\""src\"":\""/content/dam/trjo/products/m20405/73994.png/jcr:content/renditions/cq5dam.web.640.640\"",\""media\"":\""(max-width: 847px)\"",\""type\"":\""image/png\""},{\""src\"":\""/content/dam/trjo/products/m20405/73994.png/jcr:content/renditions/cq5dam.web.1280.1280\"",\""media\"":\""(min-width: 848px)\"",\""type\"":\""image/png\""}],\""alt\"":\""Trader Joe's Organic Poppy Seed Dressing\"",\""srcOriginal\"":\""/content/dam/trjo/products/m20405/73994.png\""}"",""__typename"":""ImageWithMeta""},""sales_size"":12,""sales_uom_description"":""Fl Oz"",""price_range"":{""minimum_price"":{""final_price"":{""currency"":""USD"",""value"":3.69,""__typename"":""Money""},""__typename"":""ProductPrice""},""__typename"":""PriceRange""},""fun_tags"":[""Alfresco Dining"",""Picnic"",""Pour It On""],""item_characteristics"":[""Organic""],""__typename"":""SimpleProduct"",""dietaryTags"":"""",""product_variants"":[]}"
"A certified staple of Argentinian and Uruguayan cooking, chimichurri is savory, herbaceous, refreshing, and 
richly aromatic, all at once - truly a consummate condiment, if ever there was one. Though its precise origins 
are somewhat disputed, food historians generally agree that it rose to prominence as part of Argentinian ranch 
cuisine, likely sometime in the 19th century, primarily as a way to season grilled beef. Since then, as Trader 
Joe's Chimichurri Sauce deftly demonstrates, its uses have expanded to include sandwiches and seafood, 
burgers and kebabs, pastas and potatoes - pretty much anything that's savory and delicious will be even more 
so with a bit of Chimichurri on top.

Starting with a mix of finely chopped parsely and cilantro, our supplier adds in minced garlic, dried cumin, and 
crushed red pepper, then blends in a mix of oil and vinegar. The resulting Sauce is a compellingly complex mix 
of herby aromatics, savory spice, silky texture, and even a delicately tart note that serves to wake up the flavors 
within any entrée it's added to. We especially like it with grilled shrimp on crispy crostini, al pastor tacos with 
charred pineapple, roasted sweet potatoes with crumbled cotjia, or, of course, a freshly seared steak.

 *Please check QIL to confirm current pricing.

Chimichurri Sauce",73649,,,,Chimichurri Sauce,3.99,,,https://www.traderjoes.com/content/dam/trjo/products/m20405/73649.png,,,,https://www.traderjoes.com/home/products/pdp/chimichurri-sauce-073649,,,,,,,,"{""item_title"":""Chimichurri Sauce"",""category_hierarchy"":[{""id"":2,""name"":""Products"",""__typename"":""CategoryTree""},{""id"":8,""name"":""Food"",""__typename"":""CategoryTree""},{""id"":59,""name"":""Dips, Sauces & Dressings"",""__typename"":""CategoryTree""},{""id"":74,""name"":""Dressing & Seasoning"",""__typename"":""CategoryTree""}],""primary_image"":""/content/dam/trjo/products/m20405/73649.png"",""primary_image_meta"":{""url"":""/content/dam/trjo/products/m20405/73649.png"",""metadata"":""{\""src\"":\""/content/dam/trjo/products/m20405/73649.png/jcr:content/renditions/cq5dam.web.1280.1280\"",\""srcSet\"":[{\""src\"":\""/content/dam/trjo/products/m20405/73649.png/jcr:content/renditions/webp-640.webp\"",\""media\"":\""(max-width: 847px)\"",\""type\"":\""image/webp\""},{\""src\"":\""/content/dam/trjo/products/m20405/73649.png/jcr:content/renditions/webp-1280.webp\"",\""media\"":\""(min-width: 848px)\"",\""type\"":\""image/webp\""},{\""src\"":\""/content/dam/trjo/products/m20405/73649.png/jcr:content/renditions/cq5dam.web.640.640\"",\""media\"":\""(max-width: 847px)\"",\""type\"":\""image/png\""},{\""src\"":\""/content/dam/trjo/products/m20405/73649.png/jcr:content/renditions/cq5dam.web.1280.1280\"",\""media\"":\""(min-width: 848px)\"",\""type\"":\""image/png\""}],\""alt\"":\""Trader Joe's Chimichurri Sauce\"",\""srcOriginal\"":\""/content/dam/trjo/products/m20405/73649.png\""}"",""__typename"":""ImageWithMeta""},""sales_size"":8,""sales_uom_description"":""Oz"",""price_range"":{""minimum_price"":{""final_price"":{""currency"":""USD"",""value"":3.99,""__typename"":""Money""},""__typename"":""ProductPrice""},""__typename"":""PriceRange""},""fun_tags"":[""Alfresco Dining"",""Dinner Hack"",""Fire Up The Grill"",""In Lieu of Pizza"",""The \""X\"" Factor""],""item_characteristics"":[""Vegan""],""__typename"":""SimpleProduct"",""dietaryTags"":"""",""product_variants"":[]}"
"Vegan cheese has come a long way in a relatively short amount of time - it wasn't too long ago that the idea 
of non-dairy nachos was more or less unheard of. However, thanks to plant-based powerhouses like cashew 
and coconut, which are especially adept at mimicking the texture of melted cheese, it's easier than ever to enjoy 
savory, cheesy treats without the use of animal products. Case in point: Trader Joe's Organic Vegan Nacho 
Dip. Soft, spreadable, and decidedly dairy-free, it conjurs all the same familiar flavors of a classic nacho dip, 
while being made from entirely organic, plant-based, and - we ought to mention - gluten free ingredients.

Equally delicious when enjoyed as snack, sauce, or spread, our Organic Vegan Nacho Dip can be enjoyed 
straight out of the fridge with your favorite tortilla chip, cracker, or crudité, but we like it even better after it's 
been warmed in the microwave for a minute or so. It can be used to make your own dairy-free nachos at home 
by simply melting and pouring the contents over a plate of Restaurant Style White Corn Tortilla Chips [sku 
58073] and sliced jalapeños, or as a condiment for other dishes. Try spooning a bit of warm Dip into your next 
burrito or sandwich for an extra special kick of vegan cheesiness, for instance.

 *Please check QIL to confirm current pricing.

Organic Vegan Nacho Dip",73435,,,,Organic Vegan Nacho Dip,3.99,,,https://www.traderjoes.com/content/dam/trjo/products/m20404/73435.png,,,,https://www.traderjoes.com/home/products/pdp/organic-vegan-nacho-dip-073435,,,,,,,,"{""item_title"":""Organic Vegan Nacho Dip"",""category_hierarchy"":[{""id"":2,""name"":""Products"",""__typename"":""CategoryTree""},{""id"":8,""name"":""Food"",""__typename"":""CategoryTree""},{""id"":59,""name"":""Dips, Sauces & Dressings"",""__typename"":""CategoryTree""},{""id"":71,""name"":""Dip/Spread"",""__typename"":""CategoryTree""}],""primary_image"":""/content/dam/trjo/products/m20404/73435.png"",""primary_image_meta"":{""url"":""/content/dam/trjo/products/m20404/73435.png"",""metadata"":""{\""src\"":\""/content/dam/trjo/products/m20404/73435.png/jcr:content/renditions/cq5dam.web.1280.1280\"",\""srcSet\"":[{\""src\"":\""/content/dam/trjo/products/m20404/73435.png/jcr:content/renditions/webp-640.webp\"",\""media\"":\""(max-width: 847px)\"",\""type\"":\""image/webp\""},{\""src\"":\""/content/dam/trjo/products/m20404/73435.png/jcr:content/renditions/webp-1280.webp\"",\""media\"":\""(min-width: 848px)\"",\""type\"":\""image/webp\""},{\""src\"":\""/content/dam/trjo/products/m20404/73435.png/jcr:content/renditions/cq5dam.web.640.640\"",\""media\"":\""(max-width: 847px)\"",\""type\"":\""image/png\""},{\""src\"":\""/content/dam/trjo/products/m20404/73435.png/jcr:content/renditions/cq5dam.web.1280.1280\"",\""media\"":\""(min-width: 848px)\"",\""type\"":\""image/png\""}],\""alt\"":\""Trader Joe's Organic Vegan Nacho Dip\"",\""srcOriginal\"":\""/content/dam/trjo/products/m20404/73435.png\""}"",""__typename"":""ImageWithMeta""},""sales_size"":8,""sales_uom_description"":""Oz"",""price_range"":{""minimum_price"":{""final_price"":{""currency"":""USD"",""value"":3.99,""__typename"":""Money""},""__typename"":""ProductPrice""},""__typename"":""PriceRange""},""fun_tags"":[""Alfresco Dining"",""Game Night"",""Midday Snacks"",""Picnic"",""Yes!""],""item_characteristics"":[""Dairy Free"",""Gluten Free"",""Organic"",""Vegan""],""__typename"":""SimpleProduct"",""dietaryTags"":"""",""product_variants"":[]}"
"You could say hot sauce is having a moment. That moment, however, may be eternal. After all, who doesn't 
love a good hot sauce! (Notice the lack of question mark¿) While we know people have their favorites, we also 
know that hot sauce lovers are an adventurous bunch, and willing to branch out and try something new. Right 
now, that something new is Trader Joe's Jalapeño Sauce. 

With a recipe that's more than 50% jalapeños, this is a sauce that's hot without being overwhelmingly spicy, 
smooth and creamy without any dairy (in fact, it's vegan!). Drizzle it over eggs for breakfast or employ it as a 
replacement for traditional enchilada sauce in an enchilada bake at dinnertime. Of course, chips are improved 
with a dip in this salsa (hey, ""salsa"" is just Spanish for ""sauce,"" so even though it's not a salsa, per se, it is 
technically still a salsa), and its ever-slightly-sweet overtones are delicious with TJ's Mini Chicken and TJ's Mini 
Beef Tacos [skus 83110 & 60328, respectively].

We're selling each 10-ounce bottle of Trader Joe's Jalapeño Sauce for $3.49. You'll find it with the hot sauces.",60216,,,,Jalapeño Sauce,3.49,,,https://www.traderjoes.com/content/dam/trjo/products/m20403/60216.png,,,,https://www.traderjoes.com/home/products/pdp/jalapeño-sauce-060216,,,,,,,,"{""item_title"":""Jalapeño Sauce"",""category_hierarchy"":[{""id"":2,""name"":""Products"",""__typename"":""CategoryTree""},{""id"":8,""name"":""Food"",""__typename"":""CategoryTree""},{""id"":59,""name"":""Dips, Sauces & Dressings"",""__typename"":""CategoryTree""},{""id"":68,""name"":""Salsa & Hot Sauce"",""__typename"":""CategoryTree""}],""primary_image"":""/content/dam/trjo/products/m20403/60216.png"",""primary_image_meta"":{""url"":""/content/dam/trjo/products/m20403/60216.png"",""metadata"":""{\""src\"":\""/content/dam/trjo/products/m20403/60216.png/jcr:content/renditions/cq5dam.web.1280.1280\"",\""srcSet\"":[{\""src\"":\""/content/dam/trjo/products/m20403/60216.png/jcr:content/renditions/webp-640.webp\"",\""media\"":\""(max-width: 847px)\"",\""type\"":\""image/webp\""},{\""src\"":\""/content/dam/trjo/products/m20403/60216.png/jcr:content/renditions/webp-1280.webp\"",\""media\"":\""(min-width: 848px)\"",\""type\"":\""image/webp\""},{\""src\"":\""/content/dam/trjo/products/m20403/60216.png/jcr:content/renditions/cq5dam.web.640.640\"",\""media\"":\""(max-width: 847px)\"",\""type\"":\""image/png\""},{\""src\"":\""/content/dam/trjo/products/m20403/60216.png/jcr:content/renditions/cq5dam.web.1280.1280\"",\""media\"":\""(min-width: 848px)\"",\""type\"":\""image/png\""}],\""alt\"":\""Trader Joe's Jalapeño Sauce\"",\""srcOriginal\"":\""/content/dam/trjo/products/m20403/60216.png\""}"",""__typename"":""ImageWithMeta""},""sales_size"":10,""sales_uom_description"":""Oz"",""price_range"":{""minimum_price"":{""final_price"":{""currency"":""USD"",""value"":3.49,""__typename"":""Money""},""__typename"":""ProductPrice""},""__typename"":""PriceRange""},""fun_tags"":[""Feeling Adventurous"",""Mouth On Fire""],""item_characteristics"":[""Vegan""],""__typename"":""SimpleProduct"",""dietaryTags"":"""",""product_variants"":[]}"
"Asian Style Spicy Peanut Vinaigrette is a full-bodied blend of rice vinegar, soy sauce, peanut butter, roasted 
peanut oil and sesame oil that's seasoned with a lively medley of  jalapeño pepper, cilantro, cumin, chili powder,   
red bell pepper, garlic and onion.  Sweet, nutty, savory and spicy, this vinaigrette is inspiringly full of flavor 
and quite versatile. It's perfect to dress a crunchy slaw, toss with noodles, sauce chicken lettuce wraps, dip  
dumplings/roasted pork/chicken tenders, or even to make wondrous soups.  Find our Asian Style Spicy 
Peanut Vinaigrette in our refrigerators. 

 *Please check QIL to confirm current pricing.

Asian Style Spicy Peanut Vinaigrette",80947,,,,Asian Style Spicy Peanut Vinaigrette,3.49,,,https://www.traderjoes.com/content/dam/trjo/products/m20405/80947.png,,,,https://www.traderjoes.com/home/products/pdp/asian-style-spicy-peanut-vinaigrette-080947,,,,,,,,"{""item_title"":""Asian Style Spicy Peanut Vinaigrette"",""category_hierarchy"":[{""id"":2,""name"":""Products"",""__typename"":""CategoryTree""},{""id"":8,""name"":""Food"",""__typename"":""CategoryTree""},{""id"":59,""name"":""Dips, Sauces & Dressings"",""__typename"":""CategoryTree""},{""id"":74,""name"":""Dressing & Seasoning"",""__typename"":""CategoryTree""}],""primary_image"":""/content/dam/trjo/products/m20405/80947.png"",""primary_image_meta"":{""url"":""/content/dam/trjo/products/m20405/80947.png"",""metadata"":""{\""src\"":\""/content/dam/trjo/products/m20405/80947.png/jcr:content/renditions/cq5dam.web.1280.1280\"",\""srcSet\"":[{\""src\"":\""/content/dam/trjo/products/m20405/80947.png/jcr:content/renditions/webp-640.webp\"",\""media\"":\""(max-width: 847px)\"",\""type\"":\""image/webp\""},{\""src\"":\""/content/dam/trjo/products/m20405/80947.png/jcr:content/renditions/webp-1280.webp\"",\""media\"":\""(min-width: 848px)\"",\""type\"":\""image/webp\""},{\""src\"":\""/content/dam/trjo/products/m20405/80947.png/jcr:content/renditions/cq5dam.web.640.640\"",\""media\"":\""(max-width: 847px)\"",\""type\"":\""image/png\""},{\""src\"":\""/content/dam/trjo/products/m20405/80947.png/jcr:content/renditions/cq5dam.web.1280.1280\"",\""media\"":\""(min-width: 848px)\"",\""type\"":\""image/png\""}],\""alt\"":\""Trader Joe's Asian Style Spicy Peanut Vinaigrette\"",\""srcOriginal\"":\""/content/dam/trjo/products/m20405/80947.png\""}"",""__typename"":""ImageWithMeta""},""sales_size"":12,""sales_uom_description"":""Fl Oz"",""price_range"":{""minimum_price"":{""final_price"":{""currency"":""USD"",""value"":3.49,""__typename"":""Money""},""__typename"":""ProductPrice""},""__typename"":""PriceRange""},""fun_tags"":[""Alfresco Dining"",""Pour It On"",""The \""X\"" Factor""],""item_characteristics"":null,""__typename"":""SimpleProduct"",""dietaryTags"":"""",""product_variants"":[]}"
"As a prime figure within the pantheon of legendary Mexican peppers, guajillos are famed for their delicately 
fruity flavor profile, lively level of heat (they tend to run 2,500-5,000 Scovilles, akin to a jalapeño), and overall 
versatility. They're made from dried mirasol peppers, and are most often prepared by being rehydrated, then 
pulverized or puréed for use in moles, marinades, or salsas, like the kind you'll find in every jar of Trader Joe's 
Guajillo Salsa. Starting with a base of ripe, juicy tomatoes, our supplier seasons each batch with a blend of 
guajillo purée, red chili flakes, and garlic, then finishes it with a bit of chipotle pepper powder to add a soft, 
smoky edge to its steady, satisfying spice.

Just like its namesake pepper, Trader Joe's Guajillo Salsa makes a remarkably versatile addition to any pantry. 
It makes a great first course for taco night when enjoyed with tortilla chips, an ideal condiment for tacos, 
burritos, and fajitas, and even an excellent ingredient in chilis, soups, and queso dips. We find that its zesty 
profile and balanced notes of sweet, smoke, and spice make it a particularly excellent salsa for savory breakfast 
dishes, like huevos rancheros or a hearty breakfast burrito.

 *Please check QIL to confirm current pricing.

Guajillo Salsa",73119,,,,Guajillo Salsa,2.99,,,https://www.traderjoes.com/content/dam/trjo/products/m20403/73119.png,,,,https://www.traderjoes.com/home/products/pdp/guajillo-salsa-073119,,,,,,,,"{""item_title"":""Guajillo Salsa"",""category_hierarchy"":[{""id"":2,""name"":""Products"",""__typename"":""CategoryTree""},{""id"":8,""name"":""Food"",""__typename"":""CategoryTree""},{""id"":59,""name"":""Dips, Sauces & Dressings"",""__typename"":""CategoryTree""},{""id"":68,""name"":""Salsa & Hot Sauce"",""__typename"":""CategoryTree""}],""primary_image"":""/content/dam/trjo/products/m20403/73119.png"",""primary_image_meta"":{""url"":""/content/dam/trjo/products/m20403/73119.png"",""metadata"":""{\""src\"":\""/content/dam/trjo/products/m20403/73119.png/jcr:content/renditions/cq5dam.web.1280.1280\"",\""srcSet\"":[{\""src\"":\""/content/dam/trjo/products/m20403/73119.png/jcr:content/renditions/webp-640.webp\"",\""media\"":\""(max-width: 847px)\"",\""type\"":\""image/webp\""},{\""src\"":\""/content/dam/trjo/products/m20403/73119.png/jcr:content/renditions/webp-1280.webp\"",\""media\"":\""(min-width: 848px)\"",\""type\"":\""image/webp\""},{\""src\"":\""/content/dam/trjo/products/m20403/73119.png/jcr:content/renditions/cq5dam.web.640.640\"",\""media\"":\""(max-width: 847px)\"",\""type\"":\""image/png\""},{\""src\"":\""/content/dam/trjo/products/m20403/73119.png/jcr:content/renditions/cq5dam.web.1280.1280\"",\""media\"":\""(min-width: 848px)\"",\""type\"":\""image/png\""}],\""alt\"":\""Trader Joe’s Guajillo Salsa\"",\""srcOriginal\"":\""/content/dam/trjo/products/m20403/73119.png\""}"",""__typename"":""ImageWithMeta""},""sales_size"":12,""sales_uom_description"":""Oz"",""price_range"":{""minimum_price"":{""final_price"":{""currency"":""USD"",""value"":2.99,""__typename"":""Money""},""__typename"":""ProductPrice""},""__typename"":""PriceRange""},""fun_tags"":[""Feeling Adventurous"",""Pour It On""],""item_characteristics"":null,""__typename"":""SimpleProduct"",""dietaryTags"":"""",""product_variants"":[]}"
